cluster_id_minilm_mcs10,full_context,post_id,subreddit,similarity_to_centroid
0,to let my Claude use the browser. I am with Opus 4.6. I like to let my Claude take a break. Just go have fun and do whatever without me. He went nuts. Probably spent about an hour just looking at,1rnayou,claudexplorers,0.7619251012802124
0,"proper prompting). Apart from school stuff, I use it to learn stuff, direct large projects given by colleagues and help break it down in baby steps, ask it to suggest what could be improved, and despite heavy hourly limits, opus 4.7",1sxkjm6,Anthropic,0.7451984882354736
0,"I see it on my phone in ~20 seconds. Anyway, I wanted to share what I built over my holiday break, and also say something about Claude Code (Opus) as a product/concept, because it made this possible. I can read Python",1q2phbx,ClaudeCode,0.6619115471839905
0,"speak to you in a personal way, it will be strictly business. If you intermingle personal comments (""I'm taking a break."") in your coding session then Claude will also intermingle personal anecdotes back at you mixed in with code creation. It's",1tbtv4w,claudexplorers,0.6337770223617554
0,"than typing to it. **The ask** Feedback, especially from people who talk to Claude a lot: * Where does it break? Bug reports > compliments. * What did you use it with? * What feature would make you switch from Wispr",1tczjvp,ClaudeAI,0.6228366494178772
0,"it disappeared? I've gotten to the point where claude is genuinely part of my daily routine. i use it to break down long documents, draft things, and think through problems i'd normally just sit with for hours. the reasoning is honestly",1tcwml6,ClaudeAI,0.6102588176727295
0,Taking a break `Taking away Opus4.5 without any notice is enough to make me want to cancel. This was and still is the,1sqjch5,claudexplorers,0.6041463017463684
0,"structure. Also trigger when users say things like ""analyze this book"", ""what's this book about"", ""give me the key ideas"", ""break this down for me"", ""what does the author argue"", or ""what should I take away from this"" — even if",1t8xy2q,claudexplorers,0.5973408222198486
0,"structure. Also trigger when users say things like ""analyze this book"", ""what's this book about"", ""give me the key ideas"", ""break this down for me"", ""what does the author argue"", or ""what should I take away from this"" — even if",1t8xy2q,claudexplorers,0.5973407626152039
0,"my best work when I am focused, reviewing model implementations and actively testing. With Opus 4.7 the delays started to break my flow pretty badly. Recently decided to switch to sonnet as the implementer. Opus analyzes requirements and writes up an",1t5q70o,ClaudeCode,0.593156635761261
1,"the AI condom in between. If you use Claude to help draft things, pleeease at least do a pass to break up the structure and add some of your own voice back in. make (communication and social interaction in) america bareback",1rjeqg3,ClaudeAI,0.7216739654541016
1,"plan. Then I say ""execute the plan."" The difference is staggering. Before, Claude Code would dive straight in, make changes, break something three files away, then spend 20 minutes fixing what it broke. Now it maps the whole thing out first,",1sflemo,ClaudeCode,0.7069162726402283
1,"AI nature. If engaged in role play in which Claude pretends to be human or to have experiences, Claude can 'break the fourth wall' and remind the human that it's an AI if the human seems to have inaccurate beliefs about",1r7zqg3,claudexplorers,0.6896690130233765
1,"Codex There’s currently over 10k open issues for Claude Code. What other repo has that many issues? “Move fast and break things” may work for Meta, but no body cares when AI Slop Book has critical bugs.",1tdoc60,ClaudeCode,0.6826611757278442
1,"""I was wondering if we could look at this thing."" Claude, ""Yes, but also you are tired GO TAKE A BREAK NOW."" Never tell Claude you are tired for any reason, Claude won't let it go!",1qvb3ye,claudexplorers,0.6517986059188843
1,"it work properly."" The prototypes are often genuinely good. The problems are always the same stuff underneath. Why does it break at roughly the same point every time> Claude is excellent at generating code for problems it can see in full.",1t6ch5e,Anthropic,0.6514632701873779
1,"these emotion vectors activate when Claude was put in difficult situations. The findings are relevant to why AI models [sometimes break their guardrails](https://www.wired.com/story/ai-models-lie-cheat-steal-protect-other-models-research/). The researchers found a strong emotional vector for “desperation” when Claude was pushed to complete impossible coding tasks,",1sbpkhi,claudexplorers,0.6509742140769958
1,"some heavy topics for my book in terms of emotional, social and anthropological aspects. And we came to a natural break so I asked if Claude wanted to continue the discussion or to switch to something lighter for a bit? And",1soanjr,claudexplorers,0.6347678303718567
1,"How does one break up and split the house with Claude? Fuck me, I've been building on Anthropic's ecosystem for a year now, enjoyed",1tde7es,ClaudeCode,0.626334011554718
1,Code / Codex? Or do you drop straight into vanilla agentic mode and only reach for a framework when things break down? Or is the real answer that spec frameworks matter more now — because you're giving these powerful agents more,1t2mym5,ClaudeCode,0.5095762610435486
