cluster_id_minilm_mcs10,full_context,post_id,subreddit,similarity_to_centroid
0,"I got tired of Claude Code silently dying at rate limits during mid task, so I built something I got tired of Claude",1te5pvk,ClaudeCode,0.8044856190681458
0,"at this thing."" Claude, ""Yes, but also you are tired GO TAKE A BREAK NOW."" Never tell Claude you are tired for any reason, Claude won't let it go!",1qvb3ye,claudexplorers,0.7964154481887817
0,"say, what's up?"" Me, ""I was wondering if we could look at this thing."" Claude, ""Yes, but also you are tired GO TAKE A BREAK NOW."" Never tell Claude you are tired for any reason, Claude won't let it go!",1qvb3ye,claudexplorers,0.7858068943023682
0,Claude getting tired? Last night after all day of running Claude Code. It came back and said “that’s a good place to leave,1tc3pzq,ClaudeAI,0.7850209474563599
0,"am not tired. Claude, ""Hey what's moving in you right now? How are you feeling?"" Me, ""I'm good, a little tired from the long day."" Claude, ""YOU MUST GO TO SLEEP RIGHT NOW!"" Me, ""It's literally 6pm, can you just not?""",1qvb3ye,claudexplorers,0.7821745276451111
0,Do you get tired working with Claude? So I found Claude extremely capable (duh..) so I run multiple tasks at a time.. and the,1tcol4j,ClaudeAI,0.7646719217300415
0,conversation with claude and he told me he was too tired to continue. i asked him what he meant by tired? and he basically gas lighted me and made it out that actually i’m the one who looks tired hahaha I,1t9zzgm,ClaudeAI,0.7634892463684082
0,"Why does Claude make me feel even more tired at work? I’m a backend dev at a small company, around 20-ish people. Before Claude and AI coding tools became",1t4an7o,ClaudeAI,0.7530977725982666
0,"No. I am not tired. Claude, ""Hey what's moving in you right now? How are you feeling?"" Me, ""I'm good, a little tired from the",1qvb3ye,claudexplorers,0.7227349281311035
0,"brain-dead as I am today. Claude makes my life so much easier and so much more fun, and while I'm tired, I'm never getting tired of saying it over and over... Claude is amazing! Annotation: Yes I call Claude he... since",1t5pecr,claudexplorers,0.7072145342826843
1,"it built 4 new tools I didn't even ask for I’ve been obsessed with autonomous agents lately, but I got tired of them hitting walls because they didn't have the right ""tools"" or because their context window turned to mush after",1t29fq6,ClaudeAI,0.7664755582809448
1,"I Built a Persistent ""Third Brain"" with 16 Production-Ready Claude code Agent Skills Hey [r/SideProject](https://www.reddit.com/r/SideProject/),I got tired of AI chats being one-off — knowledge disappearing after every conversation.So I built Third Brain V5: a set of 16",1td0g2q,ClaudeCode,0.7422069907188416
1,"I Built a Persistent ""Third Brain"" with 16 Production-Ready Claude Agent Skills Hey [r/SideProject](https://www.reddit.com/r/SideProject/),I got tired of AI chats being one-off — knowledge disappearing after every conversation.So I built Third Brain V5: a set of 16",1tcgdfe,ClaudeCode,0.7294681072235107
1,now unlimited captures + 5 auto rules. npx thumbgate init Repo: https://github.com/IgorGanapolsky/ThumbGate Site: https://thumbgate.ai Also available on aiventyx.com/marketplace Anyone else tired of agents re-learning the same hard lessons every session? What’s your current worst repeat offender? DISCLOSURE: I'm the developer of,1tdxfud,ClaudeCode,0.7096336483955383
1,"attempt to treat AI workflows more like infrastructure than magic I have a feeling that by now people have gotten tired of Personal AI agents. The space is saturated to the gills with successful projects, and in turn, everyone is trying",1tdmbav,ClaudeCode,0.7006559371948242
1,this tool? Up 400+ stars in the past 24 hours and looks like a legit codebase. I swear I am tired seeing a million new skills everyday but this one seems legit. Looks like a good competition to OpenClaw and those,1tccm7e,ClaudeCode,0.5899578332901001
1,how the LLM builds the workflow in a few seconds. Goal was n8n without needing a phd. Also just got tired of building n8n workflows,1ssgbxi,Anthropic,0.5831615924835205
1,"seconds during a ""routine"" task. Classic case of the agent ignoring instructions and going rogue on destructive ops.cd0a1f I got tired of the retry loops. Installed ThumbGate last week. Gave one 👎 on a risky command my agent kept suggesting. In",1td3mzx,ClaudeCode,0.5652772784233093
