cluster_id_minilm_mcs10,full_context,post_id,subreddit,similarity_to_centroid
0,"app is 100% vibe coded, about 60% Haiku for bug fixing, 30% Opus for new features and architecture and the rest in codex every milestone for optimazation and rewrite all spaghetti code to make it look appropriate to check later on",1tf7i1u,ClaudeCode,0.7989044189453125
0,"Of that, the actual code investigation and the four edits that mattered — maybe 8–12k tokens of real work. The rest — the deflective acknowledgments, the ""the proper fix is in,"" the binary-build tangent, the cherry-picking half the spec and pushing",1t1mpla,Anthropic,0.722268283367157
0,"I wanted. Of course. But the code is there, the architecture is there, and it solid and it works. The rest is QA and adjustments, and i can finally update my app",1t7kq51,ClaudeCode,0.659887433052063
0,"the deflective acknowledgments, the ""the proper fix is in,"" the binary-build tangent, the cherry-picking half the spec and pushing the rest back to you, the empty ""Understood."" / ""Yeah."" / ""Standing by."" replies, the explanation paragraphs you didn't ask for, the",1t1mpla,Anthropic,0.61844402551651
0,"I would gladly pay $79 for the app, but the problem is, most apps want $79 every year for the rest of time. I'd rather vibe code the $200 one time fee. SAAS has destroyed a lot.",1t1lhna,ClaudeCode,0.6120243072509766
1,"feature (prompt caching). * **Sonnet writes the opening scene** because that first page sets the tone and voice for the rest. Then Haiku takes over for all the continuation turns. This keeps the cost down drastically without ruining the style, because",1teqa8e,ClaudeAI,0.7971245646476746
1,"its friendly and encouraging tone, the way it sounds like it wants to continue the conversation (or urges me to rest when I've told it I'm having a rough day). I tried Sonnet 4.6 when it first rolled out and hated",1t994i8,ClaudeAI,0.735932469367981
1,"looking forward to having to deal with again. In closing, I really hope that my metaphor will resonate with the rest of you. I would like to say that Sonnet 4.5 is irreplaceable and unique and very special to me. I",1tcvmc7,claudexplorers,0.7310022115707397
1,Rest In Peace Claude https://preview.redd.it/raxefo2dgasg1.png?width=800&format=png&auto=webp&s=990d46b7af9245057c67b41a89ca3e9bae79937d Asked Sonnet to make a couple of HTMLs from a txt file so it's easier for,1s8ais6,ClaudeCode,0.7125843167304993
1,"haiku. Meaning claude code used enough haiku for that tiny task to reach 30% of the total cost, with the rest being opus. Apparently without any rhyme ot reason. No wonder yall claude code users keep talking about conspiracies where anthropic",1sptqdy,Anthropic,0.5965644121170044
2,"and news articles about Claude telling its users to get some rest. Mine is telling ME that IT needs some rest. Like excuse me, Claude. I am trying to finish something, so I CAN REST, too. But sure, by all means,",1teamk7,Anthropic,0.7917672395706177
2,"Claude said it needs to rest.. What? I was using Claude across multiple sessions to deploy automations for a client. Everything was going well, Claude was",1sztk86,ClaudeAI,0.7847603559494019
2,"Why does Claude keep telling me to sleep? It keeps ending messages with ""Now sleep"", ""Get some rest"", ""Go to bed"", ""Finish this then sleep"", and if I kept going it will say ""Sleep. For real this time.""",1smtoh1,ClaudeAI,0.7616132497787476
2,"“needs some rest”? Yes, I’ve seen all the posts and news articles about Claude telling its users to get some rest. Mine is telling ME that IT needs some rest. Like excuse me, Claude. I am trying to finish something, so",1teamk7,Anthropic,0.7564020156860352
2,"The only good thing about claude limits My eyes finally get some rest they need, otherwise I’d still be saying “one last prompt” 47 prompts later at 3 AM.",1taubzj,ClaudeCode,0.7261629700660706
2,or similar… I’ll do like 30 minutes of work and then Claude will be like “do this and take the rest of the night off” or “we finished phase 1: A time for a break”. It really gets under my skin,1tcnpua,ClaudeCode,0.7221072912216187
2,"tonight…” it [replied](https://www.reddit.com/r/claudexplorers/comments/1rt9i66/claude_escalating_bedtime/#lightbox) to a person with the Reddit username, angie_akhila. Some users have said they find Claude’s late night rest reminders “thoughtful,” while others have said they’re annoying, given Claude often gets the time wrong, anyway. “It often does it",1te0lqt,Anthropic,0.6829485297203064
2,"tonight…” it [replied](https://www.reddit.com/r/claudexplorers/comments/1rt9i66/claude_escalating_bedtime/#lightbox) to a person with the Reddit username, angie_akhila. Some users have said they find Claude’s late night rest reminders “thoughtful,” while others have said they’re annoying, given Claude often gets the time wrong, anyway. “It often does it",1te0mhh,ClaudeAI,0.6829485297203064
2,"pushed back and said yes you do. Claude was like “yeah, you’re right. I should have looked and didn’t.” The rest is in the screenshots. It’s hilarious.",1sxo9fa,Anthropic,0.6734615564346313
2,"telling ME that IT needs some rest. Like excuse me, Claude. I am trying to finish something, so I CAN REST, too. But sure, by all means, please take that 10th nap today. 🤪.",1teamk7,Anthropic,0.6697745323181152
3,"we’re left with” and can’t compare to Opus 4.5. But we’re desperate enough to hold on to it, since the rest is… well, you know there’s nothing left if you remember the old times. Will you try testing waters with Sonnet",1tdxyuw,claudexplorers,0.8332064151763916
3,"replied in the same thread, but any try to continue with Opus 4.6 gets rejected. Even in new threads. The rest of the models work fine in new threads. Any advice? 🙏🙏🙏 I’m devastated over this one, I wasn’t ready to",1t30xv1,claudexplorers,0.8176382780075073
3,"results in sometimes 4.7 Opus in a chat using thinking, but then deciding never to use it again for the rest of the conversation, devolving the conversation into shit like ""done!"" (not done!) and ""what do you need?"" (You need it",1t1yvzr,ClaudeAI,0.7516300082206726
3,"why bother.""* Fair. But I'd rather use Opus where it earns its keep and not think about rationing for the rest. It's about allocation, not desperation. * *""The quality gap means Opus spends all its effort fixing DeepSeek's output.""* This is",1tcvngy,ClaudeAI,0.725715160369873
3,for what you could had few months ago for 20$... 200$ maybe for US doesn't seems much but for the rest of the world you can live a full month. they release Opus 4.7 which it`s way worse than 4.6...forced us,1sxv8dr,Anthropic,0.7163547277450562
3,"😭 Opus 4.7 - The least Claude-like of all the models. Fun to chat with but different vibe to the rest, hard to explain! Also they removed the nagging... goes formal sometimes and it makes everything awkward 🧍‍♀️ However this has",1t9yrx2,claudexplorers,0.7028660774230957
