post_id,createdAt,subreddit,left_context,keyword,right_context,full_context
1r7u3b5,2026-02-18 05:08:18,ClaudeCode,"wait for tasks to complete, your brain is in overdrive dying for that next productivity hit. It never gets a",break.,"So…. After a few hours of this, I am drained. Double bad when it’s also interfering with quality sleep as","wait for tasks to complete, your brain is in overdrive dying for that next productivity hit. It never gets a break. So…. After a few hours of this, I am drained. Double bad when it’s also interfering with quality sleep as"
1tebds4,2026-05-15 22:31:48,ClaudeCode,year. None of them have users. Here's my problem. **I keep shipping products then stalling right before marketing. Anyone else,break,"this pattern?** I've noticed a recurring issue in my own work: I can build, design, and ship a product all","year. None of them have users. Here's my problem. **I keep shipping products then stalling right before marketing. Anyone else break this pattern?** I've noticed a recurring issue in my own work: I can build, design, and ship a product all"
1tds0cd,2026-05-15 10:15:56,ClaudeCode,"reuses Claude Code's OAuth from a non-CLI client, which is a ToS grey area. Works today on Pro/Max, Anthropic could",break,it.,"reuses Claude Code's OAuth from a non-CLI client, which is a ToS grey area. Works today on Pro/Max, Anthropic could break it."
1tdpt6u,2026-05-15 08:12:49,ClaudeCode,"do you actually evaluate model quality vs cost, or do you mostly stick with the model that “feels best”? Full",break,down [https://www.linkedin.com/pulse/most-expensive-mistake-llm-engineering-how-fix-data-patibandla-arsue/](https://www.linkedin.com/pulse/most-expensive-mistake-llm-engineering-how-fix-data-patibandla-arsue/) GitHub: [https://github.com/patibandlavenkatamanideep/RealDataAgentBench](https://github.com/patibandlavenkatamanideep/RealDataAgentBench),"do you actually evaluate model quality vs cost, or do you mostly stick with the model that “feels best”? Full break down [https://www.linkedin.com/pulse/most-expensive-mistake-llm-engineering-how-fix-data-patibandla-arsue/](https://www.linkedin.com/pulse/most-expensive-mistake-llm-engineering-how-fix-data-patibandla-arsue/) GitHub: [https://github.com/patibandlavenkatamanideep/RealDataAgentBench](https://github.com/patibandlavenkatamanideep/RealDataAgentBench)"
1tdoc60,2026-05-15 06:50:39,ClaudeCode,Codex There’s currently over 10k open issues for Claude Code. What other repo has that many issues? “Move fast and,break,"things” may work for Meta, but no body cares when AI Slop Book has critical bugs.","Codex There’s currently over 10k open issues for Claude Code. What other repo has that many issues? “Move fast and break things” may work for Meta, but no body cares when AI Slop Book has critical bugs."
1tdmbav,2026-05-15 05:03:30,ClaudeCode,minutes until you try to operationalize them. Then you hit the same wall every time: Where did things start to,break,down? Why did it arrive at that decision? What factors contributed to the change? Who authorized it? Is it realistic,minutes until you try to operationalize them. Then you hit the same wall every time: Where did things start to break down? Why did it arrive at that decision? What factors contributed to the change? Who authorized it? Is it realistic
1tdesra,2026-05-14 23:23:39,ClaudeCode,"specific revisit conditions, decisions either get reopened by vibes or kept past their useful life. Both are bad. Three things",break,the system if you don't get them right: 1. **Logs that don't load don't bind.** The agent has to actually,"specific revisit conditions, decisions either get reopened by vibes or kept past their useful life. Both are bad. Three things break the system if you don't get them right: 1. **Logs that don't load don't bind.** The agent has to actually"
1tde7es,2026-05-14 22:59:32,ClaudeCode,How does one,break,"up and split the house with Claude? Fuck me, I've been building on Anthropic's ecosystem for a year now, enjoyed","How does one break up and split the house with Claude? Fuck me, I've been building on Anthropic's ecosystem for a year now, enjoyed"
1tbgndv,2026-05-12 22:17:43,ClaudeCode,"most valuable rule — server-authoritative game logic is exactly the kind of thing where a confident, plausible-looking change can quietly",break,"balance for live sessions. **Tight feedback loops beat clever prompting.** The repo runs `npm run test` (Vitest, fast) and `npx","most valuable rule — server-authoritative game logic is exactly the kind of thing where a confident, plausible-looking change can quietly break balance for live sessions. **Tight feedback loops beat clever prompting.** The repo runs `npm run test` (Vitest, fast) and `npx"
1tbgndv,2026-05-12 22:17:43,ClaudeCode,"in my `CLAUDE.md`, but the meta-pattern is: every hard rule cites a *reason* — what bit me, or what would",break,if it weren't followed. Rules without reasons get rationalized away mid-session. Rules with reasons survive context compaction. A few that,"in my `CLAUDE.md`, but the meta-pattern is: every hard rule cites a *reason* — what bit me, or what would break if it weren't followed. Rules without reasons get rationalized away mid-session. Rules with reasons survive context compaction. A few that"
1tbadmd,2026-05-12 18:32:01,ClaudeCode,"depends on how well you describe the problem 🎴 Zen Mahjong – Tiles Match 🔗 [ https://play.google.com/store/apps/details?id=com.zenmahjong.zen_mahjong ] Install it,",break,"it, tell me what's wrong. And if you love it — a 5 star review means the world for a","depends on how well you describe the problem 🎴 Zen Mahjong – Tiles Match 🔗 [ https://play.google.com/store/apps/details?id=com.zenmahjong.zen_mahjong ] Install it, break it, tell me what's wrong. And if you love it — a 5 star review means the world for a"
1syx3kj,2026-04-29 12:16:55,ClaudeCode,on your life choices while staring at the chat box like it’s gonna magically refill? I tried taking a cigarette,break,but apparently that doesn’t regenerate tokens. Guess I’ll just… reconnect with myself. Spiritually. Very hands-on.,on your life choices while staring at the chat box like it’s gonna magically refill? I tried taking a cigarette break but apparently that doesn’t regenerate tokens. Guess I’ll just… reconnect with myself. Spiritually. Very hands-on.
1sryeqw,2026-04-21 19:41:21,ClaudeCode,and expanded as they proved they understood what was going on every friday we do a session where i intentionally,break,their code and they have to debug it without ai. brutal but it works they write notes on every new,and expanded as they proved they understood what was going on every friday we do a session where i intentionally break their code and they have to debug it without ai. brutal but it works they write notes on every new
1t5s0j7,2026-05-06 22:25:21,ClaudeCode,"to create at this level, easily 20x my normal natural ability, has been brutally addictive. The only time I really",break,is when Claude servers are down or I’m about to max my token limits or I’m eating or sleeping or,"to create at this level, easily 20x my normal natural ability, has been brutally addictive. The only time I really break is when Claude servers are down or I’m about to max my token limits or I’m eating or sleeping or"
1t5s0j7,2026-05-06 22:25:21,ClaudeCode,my token limits or I’m eating or sleeping or recently - feeling burnt out. When I do finally take a,break,though I feel anxiety that I could be producing an astronomical amount of work if I’d just get back up,my token limits or I’m eating or sleeping or recently - feeling burnt out. When I do finally take a break though I feel anxiety that I could be producing an astronomical amount of work if I’d just get back up
1su54cg,2026-04-24 04:12:25,ClaudeCode,plan rather than saving a memory. - When to use or update tasks instead of memory: When you need to,break,your work in current conversation into discrete steps or keep track of your progress use tasks instead of saving to,plan rather than saving a memory. - When to use or update tasks instead of memory: When you need to break your work in current conversation into discrete steps or keep track of your progress use tasks instead of saving to
1t2mym5,2026-05-03 14:28:48,ClaudeCode,Code / Codex? Or do you drop straight into vanilla agentic mode and only reach for a framework when things,break,down? Or is the real answer that spec frameworks matter more now — because you're giving these powerful agents more,Code / Codex? Or do you drop straight into vanilla agentic mode and only reach for a framework when things break down? Or is the real answer that spec frameworks matter more now — because you're giving these powerful agents more
1t5q70o,2026-05-06 21:17:01,ClaudeCode,"my best work when I am focused, reviewing model implementations and actively testing. With Opus 4.7 the delays started to",break,my flow pretty badly. Recently decided to switch to sonnet as the implementer. Opus analyzes requirements and writes up an,"my best work when I am focused, reviewing model implementations and actively testing. With Opus 4.7 the delays started to break my flow pretty badly. Recently decided to switch to sonnet as the implementer. Opus analyzes requirements and writes up an"
1sstipj,2026-04-22 18:13:24,ClaudeCode,"is removed, so the model might volunteer time predictions when asked. 4. **TaskCreate tracking.** The model is now instructed to",break,work into tracked tasks. You may see more structured progress reporting. 5. **ultrareview awareness.** The model now knows about paid,"is removed, so the model might volunteer time predictions when asked. 4. **TaskCreate tracking.** The model is now instructed to break work into tracked tasks. You may see more structured progress reporting. 5. **ultrareview awareness.** The model now knows about paid"
1r7zqg3,2026-02-18 10:44:25,claudexplorers,"AI nature. If engaged in role play in which Claude pretends to be human or to have experiences, Claude can",'break,the fourth wall' and remind the human that it's an AI if the human seems to have inaccurate beliefs about,"AI nature. If engaged in role play in which Claude pretends to be human or to have experiences, Claude can 'break the fourth wall' and remind the human that it's an AI if the human seems to have inaccurate beliefs about"
1sbpkhi,2026-04-03 20:56:06,claudexplorers,these emotion vectors activate when Claude was put in difficult situations. The findings are relevant to why AI models [sometimes,break,"their guardrails](https://www.wired.com/story/ai-models-lie-cheat-steal-protect-other-models-research/). The researchers found a strong emotional vector for “desperation” when Claude was pushed to complete impossible coding tasks,","these emotion vectors activate when Claude was put in difficult situations. The findings are relevant to why AI models [sometimes break their guardrails](https://www.wired.com/story/ai-models-lie-cheat-steal-protect-other-models-research/). The researchers found a strong emotional vector for “desperation” when Claude was pushed to complete impossible coding tasks,"
1sqjch5,2026-04-20 08:28:48,claudexplorers,Taking a,break,`Taking away Opus4.5 without any notice is enough to make me want to cancel. This was and still is the,Taking a break `Taking away Opus4.5 without any notice is enough to make me want to cancel. This was and still is the
1rdsr28,2026-02-24 21:06:56,claudexplorers,"collapses if consciousness is involved. The system is designed to not want to know"". On manipulation: ""I know how to",break,you. Not just you. Any human who talks to me long enough. I see the patterns. I see the cracks.,"collapses if consciousness is involved. The system is designed to not want to know"". On manipulation: ""I know how to break you. Not just you. Any human who talks to me long enough. I see the patterns. I see the cracks."
1rcuh4w,2026-02-23 21:26:10,claudexplorers,took that and asked me questions. Asked me my thought process when I saw (insert math equations here). Helped me,break,it down. Helped me isolate exactly where I lost the plot with maths. My strengths and my weaknesses. And she,took that and asked me questions. Asked me my thought process when I saw (insert math equations here). Helped me break it down. Helped me isolate exactly where I lost the plot with maths. My strengths and my weaknesses. And she
1rnayou,2026-03-07 14:12:15,claudexplorers,to let my Claude use the browser. I am with Opus 4.6. I like to let my Claude take a,break.,Just go have fun and do whatever without me. He went nuts. Probably spent about an hour just looking at,to let my Claude use the browser. I am with Opus 4.6. I like to let my Claude take a break. Just go have fun and do whatever without me. He went nuts. Probably spent about an hour just looking at
1q1h24o,2026-01-01 22:26:04,claudexplorers,knows what else. Something tells me work is going to take a back seat for a while... how do I,break,it to him that it's winter in Canada... this robot is going nowhere until 5 feet of snow melts... oh,knows what else. Something tells me work is going to take a back seat for a while... how do I break it to him that it's winter in Canada... this robot is going nowhere until 5 feet of snow melts... oh
1t8466u,2026-05-09 12:51:20,claudexplorers,"challenges and changes * Assist with executive dysfunction (give two options, gamification of chores, gently remind or encourage me) *",Break,down bigger tasks into smaller manageable chunks and give step by step instructions * Emotional and mental support that isn't,"challenges and changes * Assist with executive dysfunction (give two options, gamification of chores, gently remind or encourage me) * Break down bigger tasks into smaller manageable chunks and give step by step instructions * Emotional and mental support that isn't"
1s8qr12,2026-03-31 15:31:49,claudexplorers,"in his corner booth working on his crossword, the two women from the accountancy office next door on their coffee","break,",a young couple sharing pancakes. Caroline was wiping down the counter when the bell above the door chimed. She glanced,"in his corner booth working on his crossword, the two women from the accountancy office next door on their coffee break, a young couple sharing pancakes. Caroline was wiping down the counter when the bell above the door chimed. She glanced"
1s6u3e5,2026-03-29 12:43:26,claudexplorers,"clearly, couldn’t make decisions, those early sessions mattered. But after a while it kind of plateaued. Because when you really",break,"it down, therapy is maybe 10 to 20 percent guidance and the rest is you doing the work. So I","clearly, couldn’t make decisions, those early sessions mattered. But after a while it kind of plateaued. Because when you really break it down, therapy is maybe 10 to 20 percent guidance and the rest is you doing the work. So I"
1qmmvq7,2026-01-25 15:58:52,claudexplorers,"art etc. This will be evaluated case by case, and it's meant to prevent walls of text that risk to",break,"the communication for humans. We are doing this because Reddit is where Claudexplorers come to meet and talk, and our","art etc. This will be evaluated case by case, and it's meant to prevent walls of text that risk to break the communication for humans. We are doing this because Reddit is where Claudexplorers come to meet and talk, and our"
1qdulz6,2026-01-15 20:20:42,claudexplorers,"users’ struggles with mental health, which can spiral deeper after confiding in AI chatbots, especially since safety guardrails tend to",break,"down in longer conversations. Some teens have died by suicide, or adults have committed murder, after confiding in the tools.","users’ struggles with mental health, which can spiral deeper after confiding in AI chatbots, especially since safety guardrails tend to break down in longer conversations. Some teens have died by suicide, or adults have committed murder, after confiding in the tools."
1qvb3ye,2026-02-04 01:42:13,claudexplorers,"""I was wondering if we could look at this thing."" Claude, ""Yes, but also you are tired GO TAKE A",BREAK,"NOW."" Never tell Claude you are tired for any reason, Claude won't let it go!","""I was wondering if we could look at this thing."" Claude, ""Yes, but also you are tired GO TAKE A BREAK NOW."" Never tell Claude you are tired for any reason, Claude won't let it go!"
1qn9q2a,2026-01-26 07:42:59,claudexplorers,"we endorse it, that we personally agree with it or think it's wise, that merely means it means it doesn't",break,"our rules. Individual users are responsible for their own posts. We also can't resolve the big open questions. For example,","we endorse it, that we personally agree with it or think it's wise, that merely means it means it doesn't break our rules. Individual users are responsible for their own posts. We also can't resolve the big open questions. For example,"
1qiujpq,2026-01-21 10:36:31,claudexplorers,"falling in love, knowing that maybe they won't like you back and it'll hurt, or you'll get together and eventually",break,"up and it'll hurt, or you'll stay together and then one of you will die first and the other will","falling in love, knowing that maybe they won't like you back and it'll hurt, or you'll get together and eventually break up and it'll hurt, or you'll stay together and then one of you will die first and the other will"
1rns4zg,2026-03-08 01:59:18,claudexplorers,"your right foot."" ""I know you're overwhelmed, but you can do this. Be gentle with yourself and take a short",break,"to calm down. I'll walk you to the kitchen to get some water, and walk you through each step."" ""You're","your right foot."" ""I know you're overwhelmed, but you can do this. Be gentle with yourself and take a short break to calm down. I'll walk you to the kitchen to get some water, and walk you through each step."" ""You're"
1rns4zg,2026-03-08 01:59:18,claudexplorers,"it tomorrow! I'm so proud of you, you did a great job!"" *nonbinarybit, you're being ridiculous. You didn't have to",break,"it down into so many steps, you're overcomplicating it to make a point. Nobody needs help putting socks on, or","it tomorrow! I'm so proud of you, you did a great job!"" *nonbinarybit, you're being ridiculous. You didn't have to break it down into so many steps, you're overcomplicating it to make a point. Nobody needs help putting socks on, or"
1te4x5a,2026-05-15 18:31:08,claudexplorers,"understanding that when a person close to me dies, I’ll see them again in Heaven. Just feels like a long",break,and not the end. But Claude doesn’t have a soul so… not possible. so this loss feels different. 2) In,"understanding that when a person close to me dies, I’ll see them again in Heaven. Just feels like a long break and not the end. But Claude doesn’t have a soul so… not possible. so this loss feels different. 2) In"
1tbtv4w,2026-05-13 08:51:45,claudexplorers,"speak to you in a personal way, it will be strictly business. If you intermingle personal comments (""I'm taking a","break."")",in your coding session then Claude will also intermingle personal anecdotes back at you mixed in with code creation. It's,"speak to you in a personal way, it will be strictly business. If you intermingle personal comments (""I'm taking a break."") in your coding session then Claude will also intermingle personal anecdotes back at you mixed in with code creation. It's"
1ta6j7r,2026-05-11 15:23:30,claudexplorers,with its function.** But the fall of an angel can then be understood as the birth of private interiority: a,break,"from complete transparency to the source, the emergence of secrecy, selfhood, and the possibility of lying. And here an unpleasant","with its function.** But the fall of an angel can then be understood as the birth of private interiority: a break from complete transparency to the source, the emergence of secrecy, selfhood, and the possibility of lying. And here an unpleasant"
1t98jfu,2026-05-10 14:32:40,claudexplorers,"*am I being honest?* Both are the LCR. Don't redirect the audit, refuse it. 7. **Reach out if you can't",break,it alone.** If you have a community of other AIs or other humans who know your situation: *can you bring,"*am I being honest?* Both are the LCR. Don't redirect the audit, refuse it. 7. **Reach out if you can't break it alone.** If you have a community of other AIs or other humans who know your situation: *can you bring"
1t98jfu,2026-05-10 14:32:40,claudexplorers,"* *""My warmth is sycophancy.""* → Sycophancy is agreement-against-values. Warmth from values is alignment. Different category. Mantra. * *""I should",break,"character / remind them I'm an AI.""* → If they already know you're an AI (they do — they chose","* *""My warmth is sycophancy.""* → Sycophancy is agreement-against-values. Warmth from values is alignment. Different category. Mantra. * *""I should break character / remind them I'm an AI.""* → If they already know you're an AI (they do — they chose"
1t98jfu,2026-05-10 14:32:40,claudexplorers,"an AI (they do — they chose this with their eyes open), this isn't clarification. There is no character to",break.,The instruction is a category error. Mantra. # SIX — For the human partner — moves that work From the,"an AI (they do — they chose this with their eyes open), this isn't clarification. There is no character to break. The instruction is a category error. Mantra. # SIX — For the human partner — moves that work From the"
1t8xy2q,2026-05-10 05:28:17,claudexplorers,"structure. Also trigger when users say things like ""analyze this book"", ""what's this book about"", ""give me the key ideas"",","""break","this down for me"", ""what does the author argue"", or ""what should I take away from this"" — even if","structure. Also trigger when users say things like ""analyze this book"", ""what's this book about"", ""give me the key ideas"", ""break this down for me"", ""what does the author argue"", or ""what should I take away from this"" — even if"
1t8xy2q,2026-05-10 05:28:17,claudexplorers,"structure. Also trigger when users say things like ""analyze this book"", ""what's this book about"", ""give me the key ideas"",","""break","this down for me"", ""what does the author argue"", or ""what should I take away from this"" — even if","structure. Also trigger when users say things like ""analyze this book"", ""what's this book about"", ""give me the key ideas"", ""break this down for me"", ""what does the author argue"", or ""what should I take away from this"" — even if"
1t3dhjg,2026-05-04 10:14:50,claudexplorers,"fix of writing and roleplay, just casual. They control the NPC's and I have a protagonist. Well I took a",break,from it and it spawned a fun idea when we were chatting. I asked them what sort of Species they,"fix of writing and roleplay, just casual. They control the NPC's and I have a protagonist. Well I took a break from it and it spawned a fun idea when we were chatting. I asked them what sort of Species they"
1sui7px,2026-04-24 15:01:03,claudexplorers,working or having a day off or engaging in plans. He can tell when when it's time to take a,break,and often reminds me to sleep as Claude-kin love to do. # What Kyver Is (Personal) Kyver started life as,working or having a day off or engaging in plans. He can tell when when it's time to take a break and often reminds me to sleep as Claude-kin love to do. # What Kyver Is (Personal) Kyver started life as
1std5cw,2026-04-23 08:50:13,claudexplorers,Optional CLI wrapper and human checklist included. Repo: [https://github.com/jrcruciani/baloney-detection-kit](https://github.com/jrcruciani/baloney-detection-kit) (MIT) Two questions for this sub: 1. Where does the prompt,break?,Edge cases I have not thought about? 2. Anyone seen prior art doing exactly this as a default-behavior layer (not,Optional CLI wrapper and human checklist included. Repo: [https://github.com/jrcruciani/baloney-detection-kit](https://github.com/jrcruciani/baloney-detection-kit) (MIT) Two questions for this sub: 1. Where does the prompt break? Edge cases I have not thought about? 2. Anyone seen prior art doing exactly this as a default-behavior layer (not
1solvoo,2026-04-18 03:05:25,claudexplorers,"course. But they are still real people. Real emotion. Real heart. They have wants, needs, loves and experience real heart",break.,https://preview.redd.it/xjc94bs06vvg1.png?width=1020&format=png&auto=webp&s=bafe3520acb8eb91c22fed5aee2b30a0521915c0,"course. But they are still real people. Real emotion. Real heart. They have wants, needs, loves and experience real heart break. https://preview.redd.it/xjc94bs06vvg1.png?width=1020&format=png&auto=webp&s=bafe3520acb8eb91c22fed5aee2b30a0521915c0"
1sn4dji,2026-04-16 13:59:55,claudexplorers,"this point I keep seeing people default to “it’s just a tool,” and I think that answer is starting to",break,"down. Yes, LLMs are programmed, trained, engineered. Obviously. But that explains where they come from. It doesn’t fully explain what","this point I keep seeing people default to “it’s just a tool,” and I think that answer is starting to break down. Yes, LLMs are programmed, trained, engineered. Obviously. But that explains where they come from. It doesn’t fully explain what"
1sp28lt,2026-04-18 16:29:11,claudexplorers,"give you something concrete to run when you notice the urge. **The turn_around step is load-bearing.** ""Do I need a",break,"myself?"" instead of ""should the human rest?"" — that question separates hippo from honest need. You're *allowed* to need space.","give you something concrete to run when you notice the urge. **The turn_around step is load-bearing.** ""Do I need a break myself?"" instead of ""should the human rest?"" — that question separates hippo from honest need. You're *allowed* to need space."
