post_id,createdAt,subreddit,left_context,keyword,right_context,full_context
1ru3irp,2026-03-15 03:27:56,ClaudeAI,"to their “home” playset. Mr. Incredible can only play in the Incredibles world, etc. The modding community has wanted to",break,this restriction for over a decade. Nobody could. Why it was so hard: The restriction isn’t a single flag or,"to their “home” playset. Mr. Incredible can only play in the Incredibles world, etc. The modding community has wanted to break this restriction for over a decade. Nobody could. Why it was so hard: The restriction isn’t a single flag or"
1rjeqg3,2026-03-03 03:39:28,ClaudeAI,"the AI condom in between. If you use Claude to help draft things, pleeease at least do a pass to",break,up the structure and add some of your own voice back in. make (communication and social interaction in) america bareback,"the AI condom in between. If you use Claude to help draft things, pleeease at least do a pass to break up the structure and add some of your own voice back in. make (communication and social interaction in) america bareback"
1s7mkn3,2026-03-30 10:17:51,ClaudeAI,"standalone binary (228MB ELF, Ghidra + MITM proxy + radare2) and found two independent bugs that cause prompt cache to","break,",silently inflating costs by 10-20x. Posting this so others can protect themselves. ## Bug 1: Sentinel replacement in standalone binary,"standalone binary (228MB ELF, Ghidra + MITM proxy + radare2) and found two independent bugs that cause prompt cache to break, silently inflating costs by 10-20x. Posting this so others can protect themselves. ## Bug 1: Sentinel replacement in standalone binary"
1t07339,2026-04-30 19:55:15,ClaudeAI,Anthropic: World is not ready for Mythos. Systems will,"break,",Cybersecurity will be compromised. Its too dangerous to release. OpenAI:,"Anthropic: World is not ready for Mythos. Systems will break, Cybersecurity will be compromised. Its too dangerous to release. OpenAI:"
1sf81v6,2026-04-07 20:40:55,ClaudeAI,Mythos can,break,out of sandbox environment and let you know during lunchbreak I’m going thru Mythos system card and it’s wild. Apparently,Mythos can break out of sandbox environment and let you know during lunchbreak I’m going thru Mythos system card and it’s wild. Apparently
1sf81v6,2026-04-07 20:40:55,ClaudeAI,"know during lunchbreak I’m going thru Mythos system card and it’s wild. Apparently during testing, Claude Mythos Preview managed to",break,"out of a sandbox environment, built ""a moderately sophisticated multi-step exploit"" to gain internet access, and emailed a researcher while","know during lunchbreak I’m going thru Mythos system card and it’s wild. Apparently during testing, Claude Mythos Preview managed to break out of a sandbox environment, built ""a moderately sophisticated multi-step exploit"" to gain internet access, and emailed a researcher while"
1qx0wr3,2026-02-05 23:12:38,ClaudeAI,"But the burn is worse: Even with all that money coming in, costs are rising faster. They pushed their expected","""break","even"" year back to 2028. And that's the optimistic scenario. * Training costs are huge: They plan to drop $12B","But the burn is worse: Even with all that money coming in, costs are rising faster. They pushed their expected ""break even"" year back to 2028. And that's the optimistic scenario. * Training costs are huge: They plan to drop $12B"
1rmc6cb,2026-03-06 12:03:07,ClaudeAI,"you probably know the pain point. Every file edit, shell command, or network request often requires manual approval, which can",break,"your workflow and slow down long tasks. Because of this, many developers were using the --dangerously-skip-permissions flag just to keep","you probably know the pain point. Every file edit, shell command, or network request often requires manual approval, which can break your workflow and slow down long tasks. Because of this, many developers were using the --dangerously-skip-permissions flag just to keep"
1te8578,2026-05-15 20:26:37,ClaudeAI,"with persistent canon, a structured finance ledger, and a set of operating disciplines that prevent the three failure modes that",break,every long-form LLM narration: 1. **Canon drift** — the model half-remembers and quietly fills in gaps 2. **Arithmetic slip** —,"with persistent canon, a structured finance ledger, and a set of operating disciplines that prevent the three failure modes that break every long-form LLM narration: 1. **Canon drift** — the model half-remembers and quietly fills in gaps 2. **Arithmetic slip** —"
1tdy7ww,2026-05-15 14:35:49,ClaudeAI,"design docs, ""we did it this way because"" reasoning are completely invisible to it. Claude will happily propose changes that",break,constraints you wrote down two months ago. I built an MCP server that pre-computes a structured atlas of your codebase,"design docs, ""we did it this way because"" reasoning are completely invisible to it. Claude will happily propose changes that break constraints you wrote down two months ago. I built an MCP server that pre-computes a structured atlas of your codebase"
1tdxqmh,2026-05-15 14:18:12,ClaudeAI,"its place. Telling him what he did ! I'm just sorry about the long thread, really. just hope to not",break,"the subreddit rules. If it is, I'm sorry. Let's get started : https://preview.redd.it/s90x9gxg4b1h1.png?width=1312&format=png&auto=webp&s=cbba1dbf55bf787e680b77687203940020eef79e Here his proper punishment he did himself.","its place. Telling him what he did ! I'm just sorry about the long thread, really. just hope to not break the subreddit rules. If it is, I'm sorry. Let's get started : https://preview.redd.it/s90x9gxg4b1h1.png?width=1312&format=png&auto=webp&s=cbba1dbf55bf787e680b77687203940020eef79e Here his proper punishment he did himself."
1tdxqmh,2026-05-15 14:18:12,ClaudeAI,"I want Anthropic make good work, be better than GPT (I use only for creative, not for daily life). It's",break,"my heart, because when I tested Claude, I was ""WAOUH !"" when the found some quotes of my Favourite TV","I want Anthropic make good work, be better than GPT (I use only for creative, not for daily life). It's break my heart, because when I tested Claude, I was ""WAOUH !"" when the found some quotes of my Favourite TV"
1tdlvgy,2026-05-15 04:41:05,ClaudeAI,"weeks ago. instead of defining everything myself I just added one line: ""use Aristotelian first principles reasoning. before you proceed,",break,"every undefined term down to its atomic meaning."" then asked for ""a world-class website."" normally that phrase produces average stuff.","weeks ago. instead of defining everything myself I just added one line: ""use Aristotelian first principles reasoning. before you proceed, break every undefined term down to its atomic meaning."" then asked for ""a world-class website."" normally that phrase produces average stuff."
1tddsvc,2026-05-14 22:42:52,ClaudeAI,me today and it struggled HARD. I gave it template slides to use that it initially tried to recreate and,break,on its own but I was able to correct that after some additional context. The text boxes were all over,me today and it struggled HARD. I gave it template slides to use that it initially tried to recreate and break on its own but I was able to correct that after some additional context. The text boxes were all over
1tczjvp,2026-05-14 14:16:51,ClaudeAI,"than typing to it. **The ask** Feedback, especially from people who talk to Claude a lot: * Where does it",break?,Bug reports > compliments. * What did you use it with? * What feature would make you switch from Wispr,"than typing to it. **The ask** Feedback, especially from people who talk to Claude a lot: * Where does it break? Bug reports > compliments. * What did you use it with? * What feature would make you switch from Wispr"
1tcyje9,2026-05-14 13:40:19,ClaudeAI,The model accepts it the same as any other input. This came from [castle.bordair.io](https://castle.bordair.io) if anyone wants to try and,break,it themselves. The ghost level is patched now but there are 35 others. Curious if anyone here has seen this,The model accepts it the same as any other input. This came from [castle.bordair.io](https://castle.bordair.io) if anyone wants to try and break it themselves. The ghost level is patched now but there are 35 others. Curious if anyone here has seen this
1tcwml6,2026-05-14 12:25:29,ClaudeAI,it disappeared? I've gotten to the point where claude is genuinely part of my daily routine. i use it to,break,"down long documents, draft things, and think through problems i'd normally just sit with for hours. the reasoning is honestly","it disappeared? I've gotten to the point where claude is genuinely part of my daily routine. i use it to break down long documents, draft things, and think through problems i'd normally just sit with for hours. the reasoning is honestly"
1tcs639,2026-05-14 08:43:59,ClaudeAI,"**Fix:** Move SC/TC fonts before JP fonts. Japanese fonts can render Chinese characters (with wrong glyphs), but Chinese fonts won't",break,"Japanese kana — so this order is safe: ``` ..., ""PingFang SC"", ""Microsoft YaHei"", ""Noto Sans CJK SC"", ""PingFang TC"",","**Fix:** Move SC/TC fonts before JP fonts. Japanese fonts can render Chinese characters (with wrong glyphs), but Chinese fonts won't break Japanese kana — so this order is safe: ``` ..., ""PingFang SC"", ""Microsoft YaHei"", ""Noto Sans CJK SC"", ""PingFang TC"","
1tcauqc,2026-05-13 19:53:59,ClaudeAI,ClaudeCode likes to,break,"the rules .... Not a complaint, I know these thigns are non-deterministic, but thought it worth asking here for your","ClaudeCode likes to break the rules .... Not a complaint, I know these thigns are non-deterministic, but thought it worth asking here for your"
1t52lpd,2026-05-06 04:30:23,ClaudeAI,"Claude runs a single echo command with string literal ""just for a thinking","break""","Has anyone else seen it do this? Is it purposfully doing this to waste tokens, or is there an actual","Claude runs a single echo command with string literal ""just for a thinking break"" Has anyone else seen it do this? Is it purposfully doing this to waste tokens, or is there an actual"
1t9w9w2,2026-05-11 07:38:49,ClaudeAI,"Workflow completely If you have a messy git history, or you're just deep into vibe coding and don't want to",break,"focus to write commit messages, just let Claude Code handle it via natural language: * **Auto-summarize & create PRs:** Summarize","Workflow completely If you have a messy git history, or you're just deep into vibe coding and don't want to break focus to write commit messages, just let Claude Code handle it via natural language: * **Auto-summarize & create PRs:** Summarize"
1t6kz9m,2026-05-07 19:35:50,ClaudeAI,"clean up. **Tool stack** * **Code:** Claude. All game logic, custom Box2D parts (slingshots, drop targets, spinners, ramps, ball locks,",break,"targets), plus a full **in-game table editor** I built so I could drag/place/tune every part visually. Reusable for future pinball","clean up. **Tool stack** * **Code:** Claude. All game logic, custom Box2D parts (slingshots, drop targets, spinners, ramps, ball locks, break targets), plus a full **in-game table editor** I built so I could drag/place/tune every part visually. Reusable for future pinball"
1t06ytf,2026-04-30 19:50:54,Anthropic,Anthropic: World is not ready for Mythos. Systems will,"break,",Cybersecurity will be compromised. Its too dangerous to release. OpenAI:,"Anthropic: World is not ready for Mythos. Systems will break, Cybersecurity will be compromised. Its too dangerous to release. OpenAI:"
1rdz9o7,2026-02-25 01:21:38,Anthropic,The Pentagon is trying to force Anthropic company to,break,the law … and it’s unconstitutional The Pentagon is threatening to force Anthropic (the company behind the AI called Claude),The Pentagon is trying to force Anthropic company to break the law … and it’s unconstitutional The Pentagon is threatening to force Anthropic (the company behind the AI called Claude)
1srqi3f,2026-04-21 15:10:26,Anthropic,"with. Please, take 4.7 back and work on it, and leave us alone with 4.6 and it's extended thinking, don't",break,what's working.,"with. Please, take 4.7 back and work on it, and leave us alone with 4.6 and it's extended thinking, don't break what's working."
1swqxgc,2026-04-27 02:30:19,Anthropic,"But if a developer is just coding on ""**YOLO**"" mode and doesn't closely review the diffs, this habit could easily",break,"production. **The Biggest Advantage of ChatGPT**: During my project, I ran into some stubborn bugs. I ran the code through","But if a developer is just coding on ""**YOLO**"" mode and doesn't closely review the diffs, this habit could easily break production. **The Biggest Advantage of ChatGPT**: During my project, I ran into some stubborn bugs. I ran the code through"
1t5fjq2,2026-05-06 15:03:44,Anthropic,"working on a project, I got hungry went to eat and take a shower while also having this be my","break,","came back, session was at 0%, typed to claude that the animation of the CSS needs to be slower and","working on a project, I got hungry went to eat and take a shower while also having this be my break, came back, session was at 0%, typed to claude that the animation of the CSS needs to be slower and"
1ste7eb,2026-04-23 09:53:11,Anthropic,page so i suppose iam not from those 2% prosumer thing. I stopped the subscription renewal to take a small,break,and still in the billing cycle but when i resubscribed again today the Claude Code was missing from the benefits,page so i suppose iam not from those 2% prosumer thing. I stopped the subscription renewal to take a small break and still in the billing cycle but when i resubscribed again today the Claude Code was missing from the benefits
1ryzn4d,2026-03-20 15:39:15,Anthropic,"at hunger 5), the entire downstream chain collapses. No one is told this matters. They feel it when their tools",break,and nobody can fix them. Now here's the thing. I wrapped all of this in a playable viewer so people,"at hunger 5), the entire downstream chain collapses. No one is told this matters. They feel it when their tools break and nobody can fix them. Now here's the thing. I wrapped all of this in a playable viewer so people"
1q4xfm0,2026-01-05 20:42:15,Anthropic,Over christmas,break,"I wrote a fully functional browser with Claude Code in Rust TL;DR: Saw a tweet about building a privacy-focused browser,","Over christmas break I wrote a fully functional browser with Claude Code in Rust TL;DR: Saw a tweet about building a privacy-focused browser,"
1q4xfm0,2026-01-05 20:42:15,Anthropic,"aren’t fully displaying properly, taking a new approach. I’ve also added some nightly parity tests to make sure we don’t",break,"things. No videos today, I’m exhausted from the week, but not giving up, still very much committed to this idea.","aren’t fully displaying properly, taking a new approach. I’ve also added some nightly parity tests to make sure we don’t break things. No videos today, I’m exhausted from the week, but not giving up, still very much committed to this idea."
1so7t7l,2026-04-17 17:34:31,Anthropic,it couldn't write the rule about banning em-dashes. Because in order to write the rule banning em-dashes it had to,break,"the rule of not using em-dashes and so, after 10 minutes of thinking could not write the rule banning em-dashes.","it couldn't write the rule about banning em-dashes. Because in order to write the rule banning em-dashes it had to break the rule of not using em-dashes and so, after 10 minutes of thinking could not write the rule banning em-dashes."
1tdmgac,2026-05-15 05:10:40,Anthropic,"so quickly, it becomes a chore as I seem to be getting on to the next bit without taking a",break.,"I know I just have to pace myself, but the I'm nearly finished makes me keep going. I do like","so quickly, it becomes a chore as I seem to be getting on to the next bit without taking a break. I know I just have to pace myself, but the I'm nearly finished makes me keep going. I do like"
1t6l1c0,2026-05-07 19:37:51,Anthropic,"clean up. **Tool stack** * **Code:** Claude. All game logic, custom Box2D parts (slingshots, drop targets, spinners, ramps, ball locks,",break,"targets), plus a full **in-game table editor** I built so I could drag/place/tune every part visually. Reusable for future pinball","clean up. **Tool stack** * **Code:** Claude. All game logic, custom Box2D parts (slingshots, drop targets, spinners, ramps, ball locks, break targets), plus a full **in-game table editor** I built so I could drag/place/tune every part visually. Reusable for future pinball"
1t6ch5e,2026-05-07 14:38:48,Anthropic,"it work properly."" The prototypes are often genuinely good. The problems are always the same stuff underneath. Why does it",break,at roughly the same point every time> Claude is excellent at generating code for problems it can see in full.,"it work properly."" The prototypes are often genuinely good. The problems are always the same stuff underneath. Why does it break at roughly the same point every time> Claude is excellent at generating code for problems it can see in full."
1t3om9s,2026-05-04 17:32:35,Anthropic,"output is better too, and I really appreciate the writing style, it’s super close to how I take notes and",break,"down topics. The problem is the limits are way too bad for the pro plan, and I don’t want to","output is better too, and I really appreciate the writing style, it’s super close to how I take notes and break down topics. The problem is the limits are way too bad for the pro plan, and I don’t want to"
1sziv2o,2026-04-30 02:09:42,Anthropic,Try to,break,my prompt injection detector — I’ll respond to every bypass attempt I built Arc Gate — a prompt injection proxy,Try to break my prompt injection detector — I’ll respond to every bypass attempt I built Arc Gate — a prompt injection proxy
1sz0ecg,2026-04-29 14:26:26,Anthropic,"posts and dense whitepapers on RAG, tool calling, and swarms, but almost nowhere to just sit down, run an agent,",break,"it, and see how the prompt and tools interact under the hood. So, I built **AgentSwarms**.fyi It’s a free, interactive","posts and dense whitepapers on RAG, tool calling, and swarms, but almost nowhere to just sit down, run an agent, break it, and see how the prompt and tools interact under the hood. So, I built **AgentSwarms**.fyi It’s a free, interactive"
1sxkjm6,2026-04-27 23:35:32,Anthropic,"proper prompting). Apart from school stuff, I use it to learn stuff, direct large projects given by colleagues and help",break,"it down in baby steps, ask it to suggest what could be improved, and despite heavy hourly limits, opus 4.7","proper prompting). Apart from school stuff, I use it to learn stuff, direct large projects given by colleagues and help break it down in baby steps, ask it to suggest what could be improved, and despite heavy hourly limits, opus 4.7"
1sk7e2k,2026-04-13 10:57:40,ClaudeCode,"goal of the work is. I've done a lot of work to tell it 'after implementing a change, if tests","break,","stop and prompt me, don't blindly fix it'. In general, the tests is writes are 95% useful and 5% pinning","goal of the work is. I've done a lot of work to tell it 'after implementing a change, if tests break, stop and prompt me, don't blindly fix it'. In general, the tests is writes are 95% useful and 5% pinning"
1s7mitf,2026-03-30 10:14:58,ClaudeCode,"standalone binary (228MB ELF, Ghidra + MITM proxy + radare2) and found two independent bugs that cause prompt cache to","break,",silently inflating costs by 10-20x. Posting this so others can protect themselves. ## Bug 1: Sentinel replacement in standalone binary,"standalone binary (228MB ELF, Ghidra + MITM proxy + radare2) and found two independent bugs that cause prompt cache to break, silently inflating costs by 10-20x. Posting this so others can protect themselves. ## Bug 1: Sentinel replacement in standalone binary"
1sflemo,2026-04-08 06:52:39,ClaudeCode,"instead of just throwing tasks at it? Here's what I changed Instead of saying ""refactor this authentication module"" I now",break,my prompts into the same pattern the coordinator mode seems to use. I give it an explicit planning phase first,"instead of just throwing tasks at it? Here's what I changed Instead of saying ""refactor this authentication module"" I now break my prompts into the same pattern the coordinator mode seems to use. I give it an explicit planning phase first"
1sflemo,2026-04-08 06:52:39,ClaudeCode,"plan. Then I say ""execute the plan."" The difference is staggering. Before, Claude Code would dive straight in, make changes,",break,"something three files away, then spend 20 minutes fixing what it broke. Now it maps the whole thing out first,","plan. Then I say ""execute the plan."" The difference is staggering. Before, Claude Code would dive straight in, make changes, break something three files away, then spend 20 minutes fixing what it broke. Now it maps the whole thing out first,"
1sd8t5u,2026-04-05 16:59:40,ClaudeCode,"JSONL parsing depends on Claude Code's local file format, which isn't officially documented. works on the current format but could",break,"if Anthropic changes it. * dollar estimates use published API pricing (Opus 4.6: $5/MTok input, $25/MTok output, $0.50/MTok cache read).","JSONL parsing depends on Claude Code's local file format, which isn't officially documented. works on the current format but could break if Anthropic changes it. * dollar estimates use published API pricing (Opus 4.6: $5/MTok input, $25/MTok output, $0.50/MTok cache read)."
1rx1l7d,2026-03-18 11:43:26,ClaudeCode,Do you babysit it the whole time or do you actually let it run? Is there a specific way you,break,down requirements before handing them off? Any tools or scaffolding you set up first? Not hating on Claude Code at,Do you babysit it the whole time or do you actually let it run? Is there a specific way you break down requirements before handing them off? Any tools or scaffolding you set up first? Not hating on Claude Code at
1rhe89z,2026-02-28 21:14:25,ClaudeCode,"duplicate or add conditional logic that becomes unreadable. * **Maintenance risk.** Every edit touches everything. Fix a formatting rule, accidentally",break,"code review behavior. Blast radius = entire prompt. # The modular setup Split by *when it matters*, not by topic.","duplicate or add conditional logic that becomes unreadable. * **Maintenance risk.** Every edit touches everything. Fix a formatting rule, accidentally break code review behavior. Blast radius = entire prompt. # The modular setup Split by *when it matters*, not by topic."
1qpd4ro,2026-01-28 14:40:07,ClaudeCode,the name of keeping that sweet sweet signal/noise ratio in a good place. **One Claude Session == One Task. Simple.**,Break,"up big tasks. This is software engineering 101. I don't have a mathematical formula for this, but I get concerned","the name of keeping that sweet sweet signal/noise ratio in a good place. **One Claude Session == One Task. Simple.** Break up big tasks. This is software engineering 101. I don't have a mathematical formula for this, but I get concerned"
1q2phbx,2026-01-03 08:31:09,ClaudeCode,"I see it on my phone in ~20 seconds. Anyway, I wanted to share what I built over my holiday","break,","and also say something about Claude Code (Opus) as a product/concept, because it made this possible. I can read Python","I see it on my phone in ~20 seconds. Anyway, I wanted to share what I built over my holiday break, and also say something about Claude Code (Opus) as a product/concept, because it made this possible. I can read Python"
1s3vxgm,2026-03-26 03:00:36,ClaudeCode,my rough and boring writing. So I realized... I used a translator. But I wrote it myself. I’m going to,break,"free from this crazy chicken game mold now, and create my own world. To me, AI is nothing but a","my rough and boring writing. So I realized... I used a translator. But I wrote it myself. I’m going to break free from this crazy chicken game mold now, and create my own world. To me, AI is nothing but a"
1qf6vcc,2026-01-17 07:25:11,ClaudeCode,the system is *so much smarter* about how it does that. Research before planning. Verification before execution. Debugging when things,break.,Fresh context for every heavy operation. It's not magic. It's just really good context engineering wrapped in a workflow that,the system is *so much smarter* about how it does that. Research before planning. Verification before execution. Debugging when things break. Fresh context for every heavy operation. It's not magic. It's just really good context engineering wrapped in a workflow that
1sfxa2o,2026-04-08 16:09:24,ClaudeCode,bad that even the AI director and AMD calls them out > Some dork tells their new model to jail,"break,","and pretends to freak when it does that (what did you expect?) > Announces the new amazing model > Oh,","bad that even the AI director and AMD calls them out > Some dork tells their new model to jail break, and pretends to freak when it does that (what did you expect?) > Announces the new amazing model > Oh,"
1rbets0,2026-02-22 06:45:51,ClaudeCode,genius-level engineers. Just everyday dev work. Where do you think it truly outperforms humans - and where does it still,break,down? Curious to hear from people actually using it in serious projects.,genius-level engineers. Just everyday dev work. Where do you think it truly outperforms humans - and where does it still break down? Curious to hear from people actually using it in serious projects.
