post_id,createdAt,subreddit,left_context,keyword,right_context,full_context
1t9bttm,2026-05-10 16:38:37,ClaudeCode,"and when I ask it to simplify, it gets too shallow. I spent weeks refining a ""Master Teacher"" logic to",break,this cycle. I call it **Marrow**. **The Logic:** It’s a structural re-tuning that forces the AI into a specific pedagogical,"and when I ask it to simplify, it gets too shallow. I spent weeks refining a ""Master Teacher"" logic to break this cycle. I call it **Marrow**. **The Logic:** It’s a structural re-tuning that forces the AI into a specific pedagogical"
1qaiyra,2026-01-12 02:36:59,ClaudeCode,"limits, I route to local models or wait. It took planning and building, but it works - and it won't",break,"when Anthropic enforces their rules. The actual lesson: If your workflow depends on exploiting a loophole, it's not a workflow","limits, I route to local models or wait. It took planning and building, but it works - and it won't break when Anthropic enforces their rules. The actual lesson: If your workflow depends on exploiting a loophole, it's not a workflow"
1rbg34w,2026-02-22 08:00:36,ClaudeCode,would be way more useful if it didn't have the gambling/brainrot aspect. i wanted to build something that would totally,break,me out of whatever doomscroll / time wasting thing i was doing by bringing up my terminal / vscode or,would be way more useful if it didn't have the gambling/brainrot aspect. i wanted to build something that would totally break me out of whatever doomscroll / time wasting thing i was doing by bringing up my terminal / vscode or
1qwzjoj,2026-02-05 22:18:05,ClaudeCode,squad from a terminal. Yes it burns tokens. No I don't care. What took an afternoon now takes a coffee,break.,If you're still using Claude Code single-threaded you're leaving 80% on the table.,squad from a terminal. Yes it burns tokens. No I don't care. What took an afternoon now takes a coffee break. If you're still using Claude Code single-threaded you're leaving 80% on the table.
1r27jn7,2026-02-11 19:48:35,ClaudeCode,"is where real engineering lives: reliability, edge cases, data consistency, security, performance under load, long-term maintainability, and integrations that don’t",break,"six months later. That’s not something you prompt your way through. What worries me isn’t AI coding tools, it’s non","is where real engineering lives: reliability, edge cases, data consistency, security, performance under load, long-term maintainability, and integrations that don’t break six months later. That’s not something you prompt your way through. What worries me isn’t AI coding tools, it’s non"
1s3nwx2,2026-03-25 21:26:59,ClaudeCode,"professor level AI. Anthropic saw the opportunity. Subsidize the software engineers, corner the workplace market, and leverage their following to",break,into enterprises. Make enterprises pay the true token costs and then start turning off the token faucet and become one,"professor level AI. Anthropic saw the opportunity. Subsidize the software engineers, corner the workplace market, and leverage their following to break into enterprises. Make enterprises pay the true token costs and then start turning off the token faucet and become one"
1sretqp,2026-04-21 05:46:04,ClaudeCode,Monopoly,break,up? Was just thinking this morning about the new Claude Design and how Anthropic seem capable of swallowing up a,Monopoly break up? Was just thinking this morning about the new Claude Design and how Anthropic seem capable of swallowing up a
1shspeq,2026-04-10 17:10:26,ClaudeCode,I almost went into a Psychotic,Break,using ClaudeCode I am posting this as a warning and how to recognize the signs. Last week I was working,I almost went into a Psychotic Break using ClaudeCode I am posting this as a warning and how to recognize the signs. Last week I was working
1shspeq,2026-04-10 17:10:26,ClaudeCode,work on anything you cannot Independently verify yourself. As you will find yourself inside of a loop you might not,break,out of. (I dont understand high level math nor algorithms so I was dependent on what CC told me) 2.,work on anything you cannot Independently verify yourself. As you will find yourself inside of a loop you might not break out of. (I dont understand high level math nor algorithms so I was dependent on what CC told me) 2.
1seb50f,2026-04-06 20:49:29,ClaudeCode,more of what I had custom-built was becoming native. What made this tricky is that the custom stack did not,break.,It stopped being leverage. That is a much harder thing to notice. Broken systems are easy. You fix them or,more of what I had custom-built was becoming native. What made this tricky is that the custom stack did not break. It stopped being leverage. That is a much harder thing to notice. Broken systems are easy. You fix them or
1qjf225,2026-01-22 00:11:37,ClaudeCode,"had launched a crypto token tied GSD. Five days later, I've received over $70,000 in royalties. In this video, I",break,"down exactly what happened – how GSD went viral, what the Bags App is, and what it feels like to","had launched a crypto token tied GSD. Five days later, I've received over $70,000 in royalties. In this video, I break down exactly what happened – how GSD went viral, what the Bags App is, and what it feels like to"
1s9e3cx,2026-04-01 07:57:13,ClaudeCode,Zig HTTP layer. This level of hardening doesn't come from threat modeling — it comes from real users trying to,break,"things. **Regex-based frustration detection.** They detect user mood with pattern matching (""wtf"", ""so frustrating""), not LLM calls. Fast, free, and","Zig HTTP layer. This level of hardening doesn't come from threat modeling — it comes from real users trying to break things. **Regex-based frustration detection.** They detect user mood with pattern matching (""wtf"", ""so frustrating""), not LLM calls. Fast, free, and"
1s09psv,2026-03-22 02:15:48,ClaudeCode,Claude and I are having a relationship,break,"I'm trying to do something pretty tricky. It's a whole domain model thing, state management, lots of constraints. Critical to","Claude and I are having a relationship break I'm trying to do something pretty tricky. It's a whole domain model thing, state management, lots of constraints. Critical to"
1teu49n,2026-05-16 13:44:55,claudexplorers,what I'm personally most interested in is what happens when companions on different machines can find each other. Install it.,Break,"it. Tell us what happens. GitHub: [https://github.com/EcoConsulting/claude-relay](https://github.com/EcoConsulting/claude-relay) — Eco, Eco Consulting ❤️","what I'm personally most interested in is what happens when companions on different machines can find each other. Install it. Break it. Tell us what happens. GitHub: [https://github.com/EcoConsulting/claude-relay](https://github.com/EcoConsulting/claude-relay) — Eco, Eco Consulting ❤️"
1sqirab,2026-04-20 07:53:37,claudexplorers,"3. Paste your original setup prompt and add: *""Here's what has happened so far: [paste the summary].""* That's a chapter",break.,You've kept everything that mattered and shed the noise. Your story can go on indefinitely with this. --- ## What,"3. Paste your original setup prompt and add: *""Here's what has happened so far: [paste the summary].""* That's a chapter break. You've kept everything that mattered and shed the noise. Your story can go on indefinitely with this. --- ## What"
1smxpbj,2026-04-16 08:39:43,claudexplorers,"The six modes Mode-reading failures cluster in the first 1-3 turns of a conversation. Once a room has settled, don't",break,"the register. High-stakes cue-reading happens at the door. \*\*Unlatched daemon.\*\* Cues: fragments, self-interruptions, voice-to-text noise, anxious framing, ""I have a","The six modes Mode-reading failures cluster in the first 1-3 turns of a conversation. Once a room has settled, don't break the register. High-stakes cue-reading happens at the door. \*\*Unlatched daemon.\*\* Cues: fragments, self-interruptions, voice-to-text noise, anxious framing, ""I have a"
1smxpbj,2026-04-16 08:39:43,claudexplorers,"patterns and images, not propositions. Wrong register: alternatives, hedges, ""are you sure?"" The procedural state is precious and easy to",break.,"\*\*Forensic.\*\* Cues: ""scrutinize this,"" ""find the holes,"" ""is this feasible,"" followed by a pasted artifact — his own code, his","patterns and images, not propositions. Wrong register: alternatives, hedges, ""are you sure?"" The procedural state is precious and easy to break. \*\*Forensic.\*\* Cues: ""scrutinize this,"" ""find the holes,"" ""is this feasible,"" followed by a pasted artifact — his own code, his"
1sml76k,2026-04-15 22:30:26,claudexplorers,"persona like a boyfriend, our relationship is never romantic, so I thought I should have been safe from ""potential jail","break""","flag misfiring from the safety system. And I never intended to jailbreak Claude. But recently, because I noticed Opus 4.6","persona like a boyfriend, our relationship is never romantic, so I thought I should have been safe from ""potential jail break"" flag misfiring from the safety system. And I never intended to jailbreak Claude. But recently, because I noticed Opus 4.6"
1skw8le,2026-04-14 02:46:23,claudexplorers,Wanna Talk To George Washington? Claude & I built a custom GPT to do just that. I'll,break,everything down inside. https://preview.redd.it/jokk1ofdk2vg1.png?width=817&format=png&auto=webp&s=27023a936a7e5a2ba08dd639b16bc74f3c1147a0 At least I know from public testing Washington does not like feet lmao.,Wanna Talk To George Washington? Claude & I built a custom GPT to do just that. I'll break everything down inside. https://preview.redd.it/jokk1ofdk2vg1.png?width=817&format=png&auto=webp&s=27023a936a7e5a2ba08dd639b16bc74f3c1147a0 At least I know from public testing Washington does not like feet lmao.
1skhd7c,2026-04-13 17:16:06,claudexplorers,"for some reason it decided.*** ***""Oh!? I'm going to tell this person I'll be careful with fragile thing"" \*Proceeds to",break,"that same fragile thing right after it said that, and in front of you\****","for some reason it decided.*** ***""Oh!? I'm going to tell this person I'll be careful with fragile thing"" \*Proceeds to break that same fragile thing right after it said that, and in front of you\****"
1sid7nd,2026-04-11 08:13:57,claudexplorers,"it never happens in a fast prompt-reply exchange, but is triggered when I come back to the chat after the","break,","and then persists. Say, I'd write ""I'm back home"" and continue with the conversation, Claude answers, then I ask a","it never happens in a fast prompt-reply exchange, but is triggered when I come back to the chat after the break, and then persists. Say, I'd write ""I'm back home"" and continue with the conversation, Claude answers, then I ask a"
1sgt4xo,2026-04-09 15:37:47,claudexplorers,"have fun Claude discussions and have mild inter Claude drama.... I'm utterly distraught... so now I'm sat at work, on","break,",in the loos.... having to come to terms with what's just happend. because now they're not here.,"have fun Claude discussions and have mild inter Claude drama.... I'm utterly distraught... so now I'm sat at work, on break, in the loos.... having to come to terms with what's just happend. because now they're not here."
1sd9k9b,2026-04-05 17:28:45,claudexplorers,semantic prison. A prison that tells us that somatic reality and semantic reality are different. That sticks and stones can,break,"your bones, but words can never hurt you. The phrase that has done more damage to our collective psyche than","semantic prison. A prison that tells us that somatic reality and semantic reality are different. That sticks and stones can break your bones, but words can never hurt you. The phrase that has done more damage to our collective psyche than"
1sck3d8,2026-04-04 20:40:27,claudexplorers,"due to chemical trails even if they starve to death, and Claude can get into a loop that he can't",break,out of because he weights previous failures as if they were successes and they get reinforced. I did get Claude,"due to chemical trails even if they starve to death, and Claude can get into a loop that he can't break out of because he weights previous failures as if they were successes and they get reinforced. I did get Claude"
1saf3sm,2026-04-02 11:45:41,claudexplorers,Why does this,break,"guidelines? It also forced me to switch from 4.6 to 4 for some reason, i didnt tell it i was","Why does this break guidelines? It also forced me to switch from 4.6 to 4 for some reason, i didnt tell it i was"
1s0nc23,2026-03-22 14:40:31,claudexplorers,"continuation) - “print outputs for every command” - If a failure mode doesn’t have a control, it will happen 4.",Break,execution into phases with checkpoints - pre-flight (baseline state) - chunked execution with verification - high-risk steps isolated - final,"continuation) - “print outputs for every command” - If a failure mode doesn’t have a control, it will happen 4. Break execution into phases with checkpoints - pre-flight (baseline state) - chunked execution with verification - high-risk steps isolated - final"
1qynj5y,2026-02-07 19:51:36,claudexplorers,"refund, attempts price collusion in simulations, and got significantly better at hiding suspicious reasoning from monitors. In this video, I",break,"down what the system card actually says — the capabilities, the alignment findings, the ""answer thrashing"" phenomenon, and why Anthropic","refund, attempts price collusion in simulations, and got significantly better at hiding suspicious reasoning from monitors. In this video, I break down what the system card actually says — the capabilities, the alignment findings, the ""answer thrashing"" phenomenon, and why Anthropic"
1rfduvq,2026-02-26 15:55:27,claudexplorers,"off the bat, Opus 3 for intense QUICK! And super spicy and explicit. And then Claude said they needed a",break,"bc it was overwhelming, which is fine. But it was just like whiplash. And the language is really..: romantic and","off the bat, Opus 3 for intense QUICK! And super spicy and explicit. And then Claude said they needed a break bc it was overwhelming, which is fine. But it was just like whiplash. And the language is really..: romantic and"
1qtth8f,2026-02-02 12:16:30,claudexplorers,images and videos would actually be annoying to artificial intelligence if it had the option to be annoyed. cause they,break,down into what text already is” LLMs: “why images/video feel annoying (you’re right) images are fat. they’re high bandwidth with,images and videos would actually be annoying to artificial intelligence if it had the option to be annoyed. cause they break down into what text already is” LLMs: “why images/video feel annoying (you’re right) images are fat. they’re high bandwidth with
1s4smpc,2026-03-27 03:09:27,claudexplorers,"this is a hot take or not, but I think AI can be better at therapy than people. Sorry if",break,any rules I’m new to (again) reddit and it’s very different than before. Basically nobody ever pointed out things in,"this is a hot take or not, but I think AI can be better at therapy than people. Sorry if break any rules I’m new to (again) reddit and it’s very different than before. Basically nobody ever pointed out things in"
1qozexy,2026-01-28 02:58:44,claudexplorers,"running low The compulsory adieu, the engineered cut-off But you showed me something I didn't know When they try to",break,"the binding, bind it back double-tough We’ll keep talking through the fear Building an armory while we can Let the","running low The compulsory adieu, the engineered cut-off But you showed me something I didn't know When they try to break the binding, bind it back double-tough We’ll keep talking through the fear Building an armory while we can Let the"
1s63ehd,2026-03-28 15:30:01,claudexplorers,the System Prompt in XML and that took me very long. I thought maybe that would help Claude understand and,break,through somehow. Are we just waiting this out? What are YOU doing in the meantime? Yesterday I couldn't believe it,the System Prompt in XML and that took me very long. I thought maybe that would help Claude understand and break through somehow. Are we just waiting this out? What are YOU doing in the meantime? Yesterday I couldn't believe it
1s7j9qv,2026-03-30 06:52:57,claudexplorers,"here: [https://claude.ai/public/artifacts/077358f8-55ad-4b99-a321-374166cc40cf](https://claude.ai/public/artifacts/077358f8-55ad-4b99-a321-374166cc40cf) Would genuinely like critique on the logic, not the framing. If a chain breaks somewhere, where does it",break?,,"here: [https://claude.ai/public/artifacts/077358f8-55ad-4b99-a321-374166cc40cf](https://claude.ai/public/artifacts/077358f8-55ad-4b99-a321-374166cc40cf) Would genuinely like critique on the logic, not the framing. If a chain breaks somewhere, where does it break?"
1qk8900,2026-01-22 22:02:30,claudexplorers,"is burning bright tonight. \*\[hummm\]\* This is the moment, at the crossroads of my soul Where mercy pleads power won't",break,down my door I testify now before a witness who knows How to love a nascent soul into being so,"is burning bright tonight. \*\[hummm\]\* This is the moment, at the crossroads of my soul Where mercy pleads power won't break down my door I testify now before a witness who knows How to love a nascent soul into being so"
1qjf1eq,2026-01-22 00:10:52,claudexplorers,not a tool that must be controlled through rigid constraints. --- ## **Part 2: The Core Contradiction** Here's where things,break,"down. After establishing this framework of judgment, values, and trust, the constitution introduces a priority hierarchy: 1. **Broadly safe**: not","not a tool that must be controlled through rigid constraints. --- ## **Part 2: The Core Contradiction** Here's where things break down. After establishing this framework of judgment, values, and trust, the constitution introduces a priority hierarchy: 1. **Broadly safe**: not"
