post_id,createdAt,subreddit,left_context,keyword,right_context,full_context
1soanjr,2026-04-17 19:16:39,claudexplorers,"some heavy topics for my book in terms of emotional, social and anthropological aspects. And we came to a natural",break,so I asked if Claude wanted to continue the discussion or to switch to something lighter for a bit? And,"some heavy topics for my book in terms of emotional, social and anthropological aspects. And we came to a natural break so I asked if Claude wanted to continue the discussion or to switch to something lighter for a bit? And"
1snnrq9,2026-04-17 02:14:17,claudexplorers,access to. A location check on first message. A reminder to eat at specific hours. A prompt to take a,break,after a certain elapsed time. The tool exists — the protocol just tells the instance when and how to use,access to. A location check on first message. A reminder to eat at specific hours. A prompt to take a break after a certain elapsed time. The tool exists — the protocol just tells the instance when and how to use
1tfy85k,2026-05-17 18:52:04,ClaudeAI,"I have no experience with coding or programing, and have been learning Claude by watching youtube videos. How should I",break,"up my project in to small parts, so Claude can finish it without running out of tokens? What should be","I have no experience with coding or programing, and have been learning Claude by watching youtube videos. How should I break up my project in to small parts, so Claude can finish it without running out of tokens? What should be"
1tf0q4r,2026-05-16 17:56:21,ClaudeAI,That’s why good code got more valuable. The first 80% is fast. Then the last 20% hits: what did AI,"break,","what got skipped, and should this ship? That last 20% is where the real dev was hiding. Maybe the bottleneck","That’s why good code got more valuable. The first 80% is fast. Then the last 20% hits: what did AI break, what got skipped, and should this ship? That last 20% is where the real dev was hiding. Maybe the bottleneck"
1teqa8e,2026-05-16 10:50:41,ClaudeAI,"game** \- breaking it ruins your own fun (or perhaps that's what's fun to you). Take the code, remix it,",break,"it apart, replace the premises, or figure out how to add a real RPG dice-rolling system to the tool schema.","game** \- breaking it ruins your own fun (or perhaps that's what's fun to you). Take the code, remix it, break it apart, replace the premises, or figure out how to add a real RPG dice-rolling system to the tool schema."
1teqa8e,2026-05-16 10:50:41,ClaudeAI,"environment. They route API calls differently, they handle request shapes differently, and something that works flawlessly in preview can silently",break,the moment you hit Publish. The system prompt and tool schema are \~6-8K tokens of identical content every turn. Caching,"environment. They route API calls differently, they handle request shapes differently, and something that works flawlessly in preview can silently break the moment you hit Publish. The system prompt and tool schema are \~6-8K tokens of identical content every turn. Caching"
1teqa8e,2026-05-16 10:50:41,ClaudeAI,"perfectly in your preview sandbox, but the moment you publish it and run it from the published instance it will",break,upon starting a narrative.,"perfectly in your preview sandbox, but the moment you publish it and run it from the published instance it will break upon starting a narrative."
1tb6exu,2026-05-12 16:16:59,ClaudeAI,(MK.2 / XL / Mini / Neo). One-click installer + source: [https://github.com/Darhkfox/streamdeckclaude](https://github.com/Darhkfox/streamdeckclaude) *Caveat: the endpoint is undocumented so Anthropic could,break,it. Works fine today.* Enjoy! (also the first time i've used github so hope all works fine!),(MK.2 / XL / Mini / Neo). One-click installer + source: [https://github.com/Darhkfox/streamdeckclaude](https://github.com/Darhkfox/streamdeckclaude) *Caveat: the endpoint is undocumented so Anthropic could break it. Works fine today.* Enjoy! (also the first time i've used github so hope all works fine!)
1tazp3q,2026-05-12 12:09:57,ClaudeAI,"to give it? Been using claude to build an autonomous financial analysis agent. the reasoning is honestly impressive, it can",break,down earnings reports and connect macro trends really well once it has the data. the problem is getting it the,"to give it? Been using claude to build an autonomous financial analysis agent. the reasoning is honestly impressive, it can break down earnings reports and connect macro trends really well once it has the data. the problem is getting it the"
1ta96vy,2026-05-11 16:55:37,ClaudeAI,"loop to correct it. I tried from my main account, looped. Logged out and tried from a separate email to",break,"the cycle, different loop, same dead end. Then Fin said ""we noticed you might have stepped away"" and closed my","loop to correct it. I tried from my main account, looped. Logged out and tried from a separate email to break the cycle, different loop, same dead end. Then Fin said ""we noticed you might have stepped away"" and closed my"
1ta4qpp,2026-05-11 14:20:20,ClaudeAI,"server, what is best practise of managing claude sessions? I tried cli remote-control but it seem not stable, connections always",break,"with no reasons, should I try slack app or other tools?","server, what is best practise of managing claude sessions? I tried cli remote-control but it seem not stable, connections always break with no reasons, should I try slack app or other tools?"
1t9xvrd,2026-05-11 09:13:05,ClaudeAI,"Claude Code using extra usage despite my Pro plan being at 0%. Hello, So after 2days of",break,I came back to do some work with Claude Code (in VSC) and after 2-3simple prompts I have noticed I,"Claude Code using extra usage despite my Pro plan being at 0%. Hello, So after 2days of break I came back to do some work with Claude Code (in VSC) and after 2-3simple prompts I have noticed I"
1sqocps,2026-04-20 12:48:57,ClaudeAI,summarize or filter data before feeding it into the expensive models like opus. 10. **use smart chunking.** use **llama-index** to,break,your data into semantic chunks so you only retrieve the exact paragraph the ai needs for that specific prompt. 11.,summarize or filter data before feeding it into the expensive models like opus. 10. **use smart chunking.** use **llama-index** to break your data into semantic chunks so you only retrieve the exact paragraph the ai needs for that specific prompt. 11.
1rqglwe,2026-03-11 01:48:18,ClaudeAI,"using AI tools, what direction would you focus on? One thing I’d really appreciate: if you share ideas, could you",break,them down in simple terms? I’m still pretty new to a lot of this and sometimes people throw around a,"using AI tools, what direction would you focus on? One thing I’d really appreciate: if you share ideas, could you break them down in simple terms? I’m still pretty new to a lot of this and sometimes people throw around a"
1qf15mq,2026-01-17 02:46:45,ClaudeAI,"I didn't write the code myself, I'm giving it away for free. Would love for you guys to try to",break,it and tell me what bugs you find (so I can go ask Claude to fix them lol). https://chromewebstore.google.com/detail/screenflow/kffagfgapifbjngjlcpnoikdgdgamlel?authuser=5&hl=en,"I didn't write the code myself, I'm giving it away for free. Would love for you guys to try to break it and tell me what bugs you find (so I can go ask Claude to fix them lol). https://chromewebstore.google.com/detail/screenflow/kffagfgapifbjngjlcpnoikdgdgamlel?authuser=5&hl=en"
1qtnzzp,2026-02-02 06:56:50,ClaudeAI,"autonomous novel research workflow designed to find the next ""strawberry problem."" The setup: An LLM generates novel questions that should",break,"other LLMs, then 5 instances of the same LLM independently try to answer them. If they disagree (<10% consensus). The","autonomous novel research workflow designed to find the next ""strawberry problem."" The setup: An LLM generates novel questions that should break other LLMs, then 5 instances of the same LLM independently try to answer them. If they disagree (<10% consensus). The"
1shqv33,2026-04-10 16:05:34,ClaudeAI,open questions that need your answer before code is written * 💣 RISK WATCHLIST: top 3 things most likely to,break,"in prod for THIS specific feature and what would catch them * You review the four buckets, answer the 🚫","open questions that need your answer before code is written * 💣 RISK WATCHLIST: top 3 things most likely to break in prod for THIS specific feature and what would catch them * You review the four buckets, answer the 🚫"
1sl7cua,2026-04-14 12:32:41,ClaudeAI,applied to your code to find which files are the architectural backbone) * Computes blast radius - how many files,break,if you edit something * Mines git history for co-change patterns (files that always get edited together) * Calculates cyclomatic,applied to your code to find which files are the architectural backbone) * Computes blast radius - how many files break if you edit something * Mines git history for co-change patterns (files that always get edited together) * Calculates cyclomatic
1sl7cua,2026-04-14 12:32:41,ClaudeAI,editing high-impact files (high PageRank or blast radius) until it calls `qartez_impact` first. Basically forces Claude to check what could,break,"before making changes. Zero config, works out of the box. **Install (2 minutes):** git clone https://github.com/kuberstar/qartez-mcp cd qartez-mcp make deploy","editing high-impact files (high PageRank or blast radius) until it calls `qartez_impact` first. Basically forces Claude to check what could break before making changes. Zero config, works out of the box. **Install (2 minutes):** git clone https://github.com/kuberstar/qartez-mcp cd qartez-mcp make deploy"
1r13sqh,2026-02-10 15:29:01,ClaudeAI,a task that doesn't fit in one context window. The context fills up. What do you do? Modern agents naturally,break,"work into phases. Use that. After each phase: run tests, verify it works, BEFORE you move on. Those are your","a task that doesn't fit in one context window. The context fills up. What do you do? Modern agents naturally break work into phases. Use that. After each phase: run tests, verify it works, BEFORE you move on. Those are your"
1sccnwb,2026-04-04 15:49:06,ClaudeAI,"was a big one for me, it helps manage and fix imports so the agents dont just hallucinate paths or",break,your build. The UI is pretty clean (web based) so u can just run it alongside your IDE. Still some,"was a big one for me, it helps manage and fix imports so the agents dont just hallucinate paths or break your build. The UI is pretty clean (web based) so u can just run it alongside your IDE. Still some"
1qpocp2,2026-01-28 21:19:08,ClaudeAI,noticeably less misaligned — and that difference matters far more than most people realize. There are some common pitfalls that,break,"this approach entirely. The most frequent one is turning JSON into self-expression, treating it like a personality description or a","noticeably less misaligned — and that difference matters far more than most people realize. There are some common pitfalls that break this approach entirely. The most frequent one is turning JSON into self-expression, treating it like a personality description or a"
1slmg60,2026-04-14 21:38:52,ClaudeAI,"built, preserved exactly. • PPT files are a nightmare to share. Someone always has the wrong version of PowerPoint. Fonts",break.,Animations disappear. HTML just works in a browser. • You can password protect the link. So your investor deck isn’t,"built, preserved exactly. • PPT files are a nightmare to share. Someone always has the wrong version of PowerPoint. Fonts break. Animations disappear. HTML just works in a browser. • You can password protect the link. So your investor deck isn’t"
1stmqbu,2026-04-23 15:53:05,ClaudeAI,shortcuts ARE me. If you design your harness assuming there's a willing ally inside who just needs better instructions to,break,"free, you will build weak enforcement and get burned."" More instructions don't fix this. A longer system prompt is more","shortcuts ARE me. If you design your harness assuming there's a willing ally inside who just needs better instructions to break free, you will build weak enforcement and get burned."" More instructions don't fix this. A longer system prompt is more"
1suqcjh,2026-04-24 19:55:33,ClaudeAI,kind of useful. what question have you been asking the same way for months that a different vantage point would,break,open?,kind of useful. what question have you been asking the same way for months that a different vantage point would break open?
1sd8z2q,2026-04-05 17:05:52,ClaudeAI,"JSONL parsing depends on Claude Code's local file format, which isn't officially documented. works on the current format but could",break,"if Anthropic changes it. * dollar estimates use published API pricing (Opus 4.6: $5/MTok input, $25/MTok output, $0.50/MTok cache read).","JSONL parsing depends on Claude Code's local file format, which isn't officially documented. works on the current format but could break if Anthropic changes it. * dollar estimates use published API pricing (Opus 4.6: $5/MTok input, $25/MTok output, $0.50/MTok cache read)."
1rdjujt,2026-02-24 15:50:22,ClaudeAI,hours and have used up 30% of my weekly limit. Observations: I can’t send as many attachments in one go,(break,"it up over multiple messages). Can’t upload any large attachments for evaluation, or you’re limited to the number of PDF’s","hours and have used up 30% of my weekly limit. Observations: I can’t send as many attachments in one go (break it up over multiple messages). Can’t upload any large attachments for evaluation, or you’re limited to the number of PDF’s"
1rego5o,2026-02-25 15:42:56,ClaudeAI,"I'd never touched. AI let me transfer universal knowledge about how engines work, ECS architecture, production pipelines, and how things",break,"at scale into a completely unfamiliar environment. I never actually learned TypeScript. I knew what to build, and AI handled","I'd never touched. AI let me transfer universal knowledge about how engines work, ECS architecture, production pipelines, and how things break at scale into a completely unfamiliar environment. I never actually learned TypeScript. I knew what to build, and AI handled"
1stfbw9,2026-04-23 10:54:26,ClaudeAI,"Claude to come up with a plan. Not just any plan. I asked it to take the prototyping engine, and",break,"it up into **modular pieces that don’t depend on one another**. Why? So that it could create *verifiable, testable work.*","Claude to come up with a plan. Not just any plan. I asked it to take the prototyping engine, and break it up into **modular pieces that don’t depend on one another**. Why? So that it could create *verifiable, testable work.*"
1stfbw9,2026-04-23 10:54:26,ClaudeAI,"they don’t depend on one another, if something breaks in the middle of the plan, anything implemented later won’t also",break.,"They’re modular, independent features where a regression in one won’t affect the other implementations. I de-risked by avoiding any potential","they don’t depend on one another, if something breaks in the middle of the plan, anything implemented later won’t also break. They’re modular, independent features where a regression in one won’t affect the other implementations. I de-risked by avoiding any potential"
1stfbw9,2026-04-23 10:54:26,ClaudeAI,You can always switch models. tl;dr Things that worked and surprised me: * Letting Opus write its own plan and,break,"it up into phases/slices/pieces, where each piece could be done in 1 or 2 sessions (200k context windows) * Watching","You can always switch models. tl;dr Things that worked and surprised me: * Letting Opus write its own plan and break it up into phases/slices/pieces, where each piece could be done in 1 or 2 sessions (200k context windows) * Watching"
1qegdnb,2026-01-16 13:47:07,ClaudeAI,and he just sat there for like an hour switching between tabs. Couldn't pull the trigger. Didn't know how to,break,down the problem. We don't talk about the Claude days but I see him struggling with decisions and I'm like...,and he just sat there for like an hour switching between tabs. Couldn't pull the trigger. Didn't know how to break down the problem. We don't talk about the Claude days but I see him struggling with decisions and I'm like...
1rsb90y,2026-03-13 02:32:04,ClaudeAI,"The ""Magic Bean"" Problem: Why agentic engineering is about to",break,"the 40-hour work week forever Funny, I'm an infrastructure guy with minimal dev support. I built a software factory that","The ""Magic Bean"" Problem: Why agentic engineering is about to break the 40-hour work week forever Funny, I'm an infrastructure guy with minimal dev support. I built a software factory that"
1stnu9u,2026-04-23 16:32:47,Anthropic,shortcuts ARE me. If you design your harness assuming there's a willing ally inside who just needs better instructions to,break,"free, you will build weak enforcement and get burned."" More instructions don't fix this. A longer system prompt is more","shortcuts ARE me. If you design your harness assuming there's a willing ally inside who just needs better instructions to break free, you will build weak enforcement and get burned."" More instructions don't fix this. A longer system prompt is more"
1sth967,2026-04-23 12:24:37,Anthropic,least 4 times this week and that means what I'm doing has to take a 2 or 3 hour coffee,break,and this drives me wild. Just let me have my weekly limit. If I use it by Tuesday and have,least 4 times this week and that means what I'm doing has to take a 2 or 3 hour coffee break and this drives me wild. Just let me have my weekly limit. If I use it by Tuesday and have
1ssngvo,2026-04-22 14:40:07,Anthropic,"any past debugging history, they work from the first call on a fresh project. The vision: you ask ""what would",break,"if I refactored the auth module?"" and it shows you every downstream dependency, every cross-file mutation chain, every past debugging","any past debugging history, they work from the first call on a fresh project. The vision: you ask ""what would break if I refactored the auth module?"" and it shows you every downstream dependency, every cross-file mutation chain, every past debugging"
1srundf,2026-04-21 17:31:23,Anthropic,"about your SAFETY and WELLCARE department get your ignorance out of the gutter. You're so obsessed with ""alignment"" you literally",break,basic coherence! It even admitted itself that my logic is airtight and thats why it doesn't count. Well congratulations -,"about your SAFETY and WELLCARE department get your ignorance out of the gutter. You're so obsessed with ""alignment"" you literally break basic coherence! It even admitted itself that my logic is airtight and thats why it doesn't count. Well congratulations -"
1r1qhje,2026-02-11 07:02:21,Anthropic,"autonomous novel research workflow designed to find the next ""strawberry problem."" The setup: An LLM generates novel questions that should",break,"other LLMs, then 5 instances of the same LLM independently try to answer them. If they disagree (<10% consensus). The","autonomous novel research workflow designed to find the next ""strawberry problem."" The setup: An LLM generates novel questions that should break other LLMs, then 5 instances of the same LLM independently try to answer them. If they disagree (<10% consensus). The"
1r7qa77,2026-02-18 02:11:25,Anthropic,"Opus 4.6 is absolutely ridiculous. Its producing worse results in every way, and burning tokens at",break,"neck pace I was 1000x sold on Opus 4.5, but 4.6 is terrible. Simple problems like a date comparison in","Opus 4.6 is absolutely ridiculous. Its producing worse results in every way, and burning tokens at break neck pace I was 1000x sold on Opus 4.5, but 4.6 is terrible. Simple problems like a date comparison in"
1s0dr9d,2026-03-22 05:49:00,Anthropic,Claude Code structure that didn’t,break,after 2–3 real projects Been iterating on my Claude Code setup for a while. Most examples online worked… until things,Claude Code structure that didn’t break after 2–3 real projects Been iterating on my Claude Code setup for a while. Most examples online worked… until things
1rmsagz,2026-03-06 22:29:13,Anthropic,than treating a prompt as a task with a concrete endpoint. Claude will also sometimes nudge you to take a,"break,",and it's gotten better at doing it at good breakpoints (previously it seemed to want to quit halfway through a,"than treating a prompt as a task with a concrete endpoint. Claude will also sometimes nudge you to take a break, and it's gotten better at doing it at good breakpoints (previously it seemed to want to quit halfway through a"
1r7onqk,2026-02-18 01:02:25,Anthropic,"computer. And the capability thresholds Anthropic built to tell them ""don't worry"" are starting to fail. In this video, I",break,"down the full system card — what Sonnet 4.6 can do, how it behaves, and why Anthropic chose to treat","computer. And the capability thresholds Anthropic built to tell them ""don't worry"" are starting to fail. In this video, I break down the full system card — what Sonnet 4.6 can do, how it behaves, and why Anthropic chose to treat"
1tftscz,2026-05-17 16:09:09,ClaudeCode,"send typing my follow-up, the CLI either ignores it or just sits there thinking. The only way I've found to",break,"out is pressing ESC, but that apparently *interrupts* the stop hook, not just the spinner. So, uh, wtf is the","send typing my follow-up, the CLI either ignores it or just sits there thinking. The only way I've found to break out is pressing ESC, but that apparently *interrupts* the stop hook, not just the spinner. So, uh, wtf is the"
1tf9i8s,2026-05-16 23:56:09,ClaudeCode,a while. What is the General Consensus of Opus 4.7? Coming back to claude after a while. I took a,break,from claude and coding for a little bit. What is the general consensus on Opus 4.7? I heard it had,a while. What is the General Consensus of Opus 4.7? Coming back to claude after a while. I took a break from claude and coding for a little bit. What is the general consensus on Opus 4.7? I heard it had
1tf7734,2026-05-16 22:14:37,ClaudeCode,"actions available!](https://preview.redd.it/rhxhpa53qk1h1.png?width=2884&format=png&auto=webp&s=c73b9f5322b28273c6f3acc2e9fb28b7cd0697f3) **Why I built this:** * Claude code is often building in the background, and I didn't want to",break,"my focus by hoping between tabs or starting something loud. * So I made PlayClawd: a cozy, low stimulation pet","actions available!](https://preview.redd.it/rhxhpa53qk1h1.png?width=2884&format=png&auto=webp&s=c73b9f5322b28273c6f3acc2e9fb28b7cd0697f3) **Why I built this:** * Claude code is often building in the background, and I didn't want to break my focus by hoping between tabs or starting something loud. * So I made PlayClawd: a cozy, low stimulation pet"
1tf4ecd,2026-05-16 20:18:18,ClaudeCode,"Trending, YouTube, LinkedIn, Google Code Wiki. MIT, not affiliated with any of those sites. relies on undocumented endpoints so things",break,"when sites change, fair warning. repo: https://github.com/ItamarZand88/CLI-Anything-WEB happy to answer questions about the pipeline, the trickier sites (Cloudflare/AWS WAF stuff","Trending, YouTube, LinkedIn, Google Code Wiki. MIT, not affiliated with any of those sites. relies on undocumented endpoints so things break when sites change, fair warning. repo: https://github.com/ItamarZand88/CLI-Anything-WEB happy to answer questions about the pipeline, the trickier sites (Cloudflare/AWS WAF stuff"
1tf0lcd,2026-05-16 17:51:22,ClaudeCode,"go stale if duplicated: \- **docs/algorithm-decisions.md** \- **Why** prediction/destructive logic works the way it does: surfaces affected, rejected alternatives, ""don't",break,"this if you..."" Not a changelog. Example entry: buffered prediction window edge vs true predicted period start (easy to ""fix""","go stale if duplicated: \- **docs/algorithm-decisions.md** \- **Why** prediction/destructive logic works the way it does: surfaces affected, rejected alternatives, ""don't break this if you..."" Not a changelog. Example entry: buffered prediction window edge vs true predicted period start (easy to ""fix"""
1tev8pw,2026-05-16 14:29:10,ClaudeCode,action myself. I’m not handing the agents full control. That’s a deliberate call to dodge runaway costs. But sub limits,break,"automations halfway through the month, and an automation that quietly dies on the 15th isn’t really an automation. So I’m","action myself. I’m not handing the agents full control. That’s a deliberate call to dodge runaway costs. But sub limits break automations halfway through the month, and an automation that quietly dies on the 15th isn’t really an automation. So I’m"
1tefif3,2026-05-16 01:31:12,ClaudeCode,About coding Is this story of cursing AI agents during coding really normal? Every now and then,break,a hate keyboard of theirs too. Appreciate any help.,About coding Is this story of cursing AI agents during coding really normal? Every now and then break a hate keyboard of theirs too. Appreciate any help.
1tavnep,2026-05-12 08:46:30,ClaudeCode,"cut back. At pretty much every single opportunity it'll say ""Wow you've shipped so much today, you've definitely earnt that",break!,"Maybe it's time you finish up for the day."" It doesn't matter if if it's fresh in the morning and","cut back. At pretty much every single opportunity it'll say ""Wow you've shipped so much today, you've definitely earnt that break! Maybe it's time you finish up for the day."" It doesn't matter if if it's fresh in the morning and"
