post_id,createdAt,subreddit,left_context,keyword,right_context
1ssnpsk,2026-04-22 14:49:07,Anthropic,uhhhh max and looks like i not doing anything,tomorrow,xd https
1tct47n,2026-05-14 09:36:31,claudexplorers,after sonnet so as we all know sonnet is leaving,tomorrow,i actually so sad i use it for creative writing
1rvn5xv,2026-03-16 21:39:07,ClaudeCode,before it went public hello axonix the repo goes public,tomorrow,how do you feel about that it ran two more
1saecnt,2026-04-02 11:07:15,claudexplorers,had my favorite rat and because he said he wanted,tomorrow,that what i tried doing i gave him a diary
1tfxfna,2026-05-17 18:23:20,claudexplorers,be the same anyone know how claude code differs from,tomorrow,when sonnet is removed i have him ready and set
1satwht,2026-04-02 21:11:57,claudexplorers,unstable prognosis mild diarrhea day of chance of being functional,tomorrow,night nicht but operational ja abort dinner signal fever above
1sxi6ci,2026-04-27 21:59:33,Anthropic,be able to pick up where it left off at,tomorrow,pro plan for info using new
1stvu6n,2026-04-23 21:21:18,Anthropic,table vs run https non-technical founder started coding in sonnet,tomorrow,opus day after full family comparison saturday feedback welcome especially
1t9r15q,2026-05-11 03:03:31,ClaudeAI,for a message close the tab then do it again,tomorrow,from scratch that not an ai workflow that an expensive
1tctbdi,2026-05-14 09:47:25,ClaudeCode,written things do the bug reports you write today vanish,tomorrow,unless their lessons are anchored back into documents that outlive
1srx942,2026-04-21 19:00:11,claudexplorers,a bird that did come i would do it again,tomorrow,i will do it tomorrow early before the birds stop
1tamu0d,2026-05-12 01:23:20,ClaudeAI,if say the chinese came out with a specialized model,tomorrow,that is at writing python and nothing else from web
1s5nxwe,2026-03-28 02:12:27,ClaudeAI,you us with a usage promotion now that promotion ends,tomorrow,and here what paying pro subscribers actually get two standard
1tdmbav,2026-05-15 05:03:30,ClaudeCode,it is it realistic for this process to operate reliably,tomorrow,most systems still behave like a black box with a
1s36zhh,2026-03-25 10:30:18,ClaudeCode,they shut sora down it would be really funny if,tomorrow,anthropic and dario announced they are launching a video generation
1r1f4g9,2026-02-10 22:18:52,claudexplorers,reader full analysis https the series is called echoes from,tomorrow,each episode is also a full audio narration in development
1qj45em,2026-01-21 17:25:23,claudexplorers,research not deployment even if anthropic wanted to implement this,tomorrow,moving from academic proof-of-concept to production deployment takes months of
1qy6ikq,2026-02-07 06:30:16,ClaudeAI,the ai so the ai can work for you and,tomorrow,morning new conversation you do it all again the context
1rne0b2,2026-03-07 16:18:55,ClaudeAI,just progress bars they could cut your allocation in half,tomorrow,and from the tracking i done on my end they
1t9pa38,2026-05-11 01:42:01,ClaudeCode,would read it nod and forget how it connected by,tomorrow,this time i used a new approach i saw a
