post_id,createdAt,subreddit,left_context,keyword,right_context
1t9uf9h,2026-05-11 05:56:21,ClaudeAI,toolchains cloud-hosted upgrades we been running a multi-agent setup since,late,february not because we read a paper because a single
1shv4ny,2026-04-10 18:36:01,ClaudeCode,killed it and went to bed as it was very,late,and reorganizing project files was always a breeze with claude
1t5pecr,2026-05-06 20:48:02,claudexplorers,hail to farmer-claude i tired it,late,at least here where i am but i just have
1sqnd5x,2026-04-20 12:06:12,claudexplorers,,late,night conversations i have had long and ongoing conversations with
1ses1qm,2026-04-07 10:24:32,ClaudeAI,quantified what changed their estimate thinking depth dropped around by,late,february not a vibe an evidence chain the hn thread
1sxb3vz,2026-04-27 17:49:20,ClaudeAI,sec edgar form insider transactions form material event filings form,late,filing notices schedule and activist filings form shelf registrations form
1tdgjoo,2026-05-15 00:38:08,ClaudeAI,metaphor the psychological literature alan himself synthesized describes it accurately,late,diagnosis of a neurodevelopmental condition produces not a simple addition
1te0lqt,2026-05-15 16:00:35,Anthropic,reddit username some users have said they find claude s,late,night rest reminders thoughtful while others have said they re
1s30ilh,2026-03-25 04:07:51,ClaudeAI,my late md phd triple boarded also coding since the,late,starting in assembly i have chops i ca believe the
1sctsqu,2026-04-05 04:07:18,claudexplorers,reminder which is milder in wording than the lcr from,late,last year but it still impacts the user experience if
1rpgdh1,2026-03-09 23:22:54,Anthropic,of defense labeled the ai startup a supply-chain risk https,late,last month according to court papers that also revealed new
1sp28lt,2026-04-18 16:29:11,claudexplorers,it wo feel natural at first you catch the urge,late,name it clumsily miss it entirely and only notice in
1t4uunu,2026-05-05 22:39:51,ClaudeAI,on the disputed strip throughout the neighbor first objected in,late,and has threatened ejectment please address whether my client can
1s30ilh,2026-03-25 04:07:51,ClaudeAI,if it messy html he here posting about his joy,late,in life discovering he can get computers to do something
1safw99,2026-04-02 12:22:43,ClaudeCode,claude code feels like a scam with the,late,problem of usage limits i actually paid for gemini and
1t0xd1i,2026-05-01 15:54:13,Anthropic,refusing to give information more than once or it s,late,you re spiraling even when it is incorrect and the
1t9krnd,2026-05-10 22:20:11,ClaudeAI,writing i going to claude first now anyway that my,late,to the party realization what specific tasks made others switch
1szb2m2,2026-04-29 20:44:10,ClaudeAI,for everyone globally non-native speaker used llm to post since,late,accelerating in early i noticed a progressive smoothing of claude
1tboj88,2026-05-13 04:01:30,claudexplorers,you it utc that late i just internally pattern-match looks,late,soften the tone suggest wrapping up if you in it
1t761f9,2026-05-08 12:09:29,ClaudeCode,signals feeling a bit surreal today we launched back in,late,april and it just crossed stars on github huge thanks
