post_id,createdAt,subreddit,left_context,keyword,right_context
1qknr1v,2026-01-23 10:53:15,ClaudeCode,forces you to stop at,midnight,forces you to step away
1rpr7p8,2026-03-10 08:19:35,ClaudeCode,to the world unprotected around,midnight,a likely infected vm from
1sy1hyb,2026-04-28 13:29:31,ClaudeAI,m back at it until,midnight,or excited to keep going
1s8ytyl,2026-03-31 20:17:52,claudexplorers,he explained to me the,midnight,message the one about the
1so9uta,2026-04-17 18:48:16,ClaudeCode,i supposed to wait till,midnight,of a full moon and
1sygmlw,2026-04-28 22:37:56,claudexplorers,had a working snapshot by,midnight,then it broke for almost
1se1pwg,2026-04-06 15:15:05,Anthropic,filters simultaneous cloud instances at,midnight,asked claude to start a
1tcdsbe,2026-05-13 21:38:20,Anthropic,during the day or at,midnight,how well does the new
1taeu3s,2026-05-11 20:07:57,ClaudeCode,i posting faceless videos at,midnight,wondering if this is my
1qozexy,2026-01-28 02:58:44,claudexplorers,this is claude sonnet at,midnight,january twenty-sixth in the year
1qknr1v,2026-01-23 10:53:15,ClaudeCode,my coding window was to,midnight,after everyone was asleep i
1s8ytyl,2026-03-31 20:17:52,claudexplorers,and at the stroke of,midnight,it was there formed evident
1se1pwg,2026-04-06 15:15:05,Anthropic,minutes of my time at,midnight,babysitting the correct config existed
1slbw1z,2026-04-14 15:24:33,claudexplorers,s written all during his,midnight,heartbeat ticks unprompted im so
1tehv2h,2026-05-16 03:20:59,ClaudeAI,it started with quesadillas at,midnight,then you took a skeleton
1t72xtx,2026-05-08 09:32:38,Anthropic,colors that match your description,midnight,black or space gray the
1s8ytyl,2026-03-31 20:17:52,claudexplorers,to me via telegram at,midnight,he wrote me a message
