post_id,type,retrieval_provenance,createdAt,subreddit,left_context,keyword,right_context
1s16eiz,comment,praw:round2_match,2026-03-23 08:03:05,ClaudeAI,just said something like claude i can manage my own,bedtime,please take a note not to say things like that
1sfk1vk,post,arctic_shift:round2_fresh,2026-04-08T05:33:53,ClaudeCode,drink it get status summary full picture with a target,bedtime,check get insights seven or thirty day report with trend
1sjp6tv,comment,praw:round2_match,2026-04-12 20:30:41,ClaudeCode,idea right now i could have a marketable product before,bedtime,there is no way i could do that before before
1t42p01,comment,praw:round2_match,2026-05-05 03:35:11,ClaudeAI,this is a,bedtime,post i can finally support
1s98kll,comment,praw:round2_match,2026-04-01 03:37:29,claudexplorers,no you probably mentioned,bedtime,somewhere in your chats so now it's updated in your
1shjmpu,post,arctic_shift:round2_fresh,2026-04-10T11:18:18,ClaudeAI,as a lippy spell checker that decided we needed a,bedtime,
1s16eiz,comment,praw:round2_match,2026-03-23 20:02:01,ClaudeAI,someone doing 7 hours of legal research gets the same,bedtime,suggestion as someone who opened claude at midnight
1szbrvy,post,arctic_shift:round2_fresh,2026-04-29T21:10:25,ClaudeCode,is my 2nd ios app built during naps and after,bedtime,no ads no tracking no data collection i started off
1sfvj1r,post,arctic_shift:round2_fresh,2026-04-08T15:06:59,ClaudeAI,drink it get status summary full picture with a target,bedtime,check get insights seven or thirty day report with trend
1set9r1,comment,praw:round2_match,2026-04-07 15:10:24,ClaudeAI,it will god forbid i mention it s close to,bedtime,it ll tell me to go to bed every message
1sfvj1r,post,arctic_shift:round2_fresh,2026-04-08T15:06:59,ClaudeAI,level current mg in your system right now get safe,bedtime,earliest time you can safely sleep simulate drink see how
1sfk1vk,post,arctic_shift:round2_fresh,2026-04-08T05:33:53,ClaudeCode,level current mg in your system right now get safe,bedtime,earliest time you can safely sleep simulate drink see how
1rt9i66,post,arctic_shift:round2_fresh|canonical:round2_match|praw:round2_match,2026-03-14 04:05:43,claudexplorers,claude escalating,bedtime,even better than last time lol and oh no opus
1ruryxo,post,praw:round2_match,2026-03-15 22:31:25,ClaudeAI,claude decided i need a,bedtime,apparently ive been building a cybersecurity platform and pulling late
1t32rzn,comment,praw:round2_match,2026-05-04 00:59:35,ClaudeAI,me to go to bed at like 8pm my normal,bedtime,is like 2am it's really annoying when i'm trying to
1qye7jd,comment,praw:round2_match,2026-02-08 02:32:33,Anthropic,because i decided to have it generate too many,bedtime,stories about my dog
1rt9i66,comment,praw:round2_match,2026-03-15 07:41:22,claudexplorers,the,bedtime,thing is coded so users so users don't have negative
1rvi83o,post,arctic_shift:round2_fresh,2026-03-16T18:44:44,ClaudeCode,claude decided i need a,bedtime,apparently
1qut7ty,comment,praw:round2_match,2026-02-04 09:55:39,claudexplorers,forget it doesn't want to lose it and sometimes it's,bedtime,stories always about a character who tries so hard to
1q3l18j,comment,praw:round2_match,2026-01-05 22:11:03,claudexplorers,how nature is now being recruited as part of a,bedtime,exit script
