post_id,type,retrieval_provenance,createdAt,subreddit,left_context,keyword,right_context
1s16eiz,comment,praw:round2_match,2026-03-23 20:02:01,ClaudeAI,eternal present someone doing 7 hours of legal research gets the same bedtime suggestion as someone who opened claude at,midnight,
1sfk1vk,post,arctic_shift:round2_fresh,2026-04-08T05:33:53,ClaudeCode,you exactly when it is safe to sleep have you ever had a late afternoon coffee and then wondered at,midnight,why you are staring at the ceiling this solves that problem using standard pharmacological decay modeling every time you log
1sfvj1r,post,arctic_shift:round2_fresh,2026-04-08T15:06:59,ClaudeAI,you exactly when it is safe to sleep have you ever had a late afternoon coffee and then wondered at,midnight,why you are staring at the ceiling this solves that problem using standard pharmacological decay modeling every time you log
1ruryxo,comment,praw:round2_match,2026-03-16 10:41:11,ClaudeAI,with timezone tells me to go to sleep all the time in the web version when i m burning that,midnight,oil
1sb2434,post,arctic_shift:round2_fresh,2026-04-03T03:08:56,ClaudeCode,at a cost i ve been coming back from work i cook do chores and then claude code till around,midnight,then i say to myself that i ll start wrapping up but then there s always this one more thing
1ruryxo,comment,praw:round2_match,2026-03-16 09:13:13,ClaudeAI,timestamp at conversation start that's why some of you are getting told to sleep at 2pm claude still thinks it's,midnight,because you resumed an old chat
