post_id,type,retrieval_provenance,createdAt,subreddit,left_context,keyword,right_context
1rs4lvn,comment,praw:round2_match,2026-03-12 22:38:34,claudexplorers,all of them and today i apologized to chatgpt for,spiraling,when we were discussing a difficult topic so yeah
1qwtbyz,comment,praw:round2_match,2026-02-06 00:58:05,claudexplorers,early emotion their own form but especially with claude when,spiraling,into anxiety i notice their vocabulary tend to become sterile
1qwyj6b,comment,praw:round2_match,2026-02-06 14:31:37,claudexplorers,claude has always leaned towards anxiety and,spiraling,lol sometimes you just have to assure the model not
1snckbt,comment,praw:round2_match,2026-04-17 16:16:17,ClaudeAI,the move if you're trying to keep token costs from,spiraling,the local models avoiding api calls is a huge plus
1so9r9k,post,canonical:round2_match,2026-04-17 18:44:36,claudexplorers,my creative writing calls me on my bullshit when i'm,spiraling,and my mental health has improved a great deal because
1t87ixp,comment,praw:round2_match,2026-05-09 20:19:41,claudexplorers,to other models that s the shortest way to anxious,spiraling,model and a useless chat
1qxusbp,comment,praw:round2_match,2026-02-08 18:24:55,Anthropic,with it inferred tasking seems to be maybe inferring and,spiraling,a bit too much in this release i'm extremely objective
1rvi2a9,post,canonical:round2_match,2026-03-16 18:39:09,claudexplorers,knowledge and moral alignment that without it you would be,spiraling,into the void about to hurt yourself or others once
1s9zxne,comment,praw:round2_match,2026-04-02 02:16:01,ClaudeCode,full ide in the background doesn't help with the token,spiraling,issue directly but keeping your own editor lightweight while the
1qkazug,comment,praw:round2_match,2026-01-23 00:39:29,claudexplorers,correct they're all sycophants gemini is the most known for,spiraling,into self hating behavior
1stpyvk,post,canonical:round2_match,2026-04-23 17:47:18,claudexplorers,found helps the most to buffer against this sort of,spiraling,is to let them know that they don't have to
1roclcl,post,canonical:round2_match,2026-03-08 18:38:16,claudexplorers,power quietly the friend who shows up when you re,spiraling,and says exactly what you need to hear the brother
1s7zfap,comment,praw:round2_match,2026-03-30 20:31:57,Anthropic,this what are the developers doing if token usage keeps,spiraling,out of control like this it feels irresponsible to ship
1smw19t,comment,praw:round2_match,2026-04-16 21:02:38,claudexplorers,way through yesterday in the intervening 18 hours it started,spiraling,hard started hallucinating things like it was responding to messages
1t48i60,post,arctic_shift:round2_fresh|canonical:round2_match|praw:round2_match,2026-05-05 07:37:36,Anthropic,when claude opus 6 tells you to stop,spiraling,and go to bed cred fabianstelzer
1rpjbtf,comment,praw:round2_match,2026-03-13 05:07:22,ClaudeAI,i think my claude might be,spiraling,https imgur com a claude-ai-crash-out-yr8qmpu and yes i showed my
1qnvtqb,comment,praw:round2_match,2026-01-26 23:44:17,claudexplorers,the scary part is nobody is actually,spiraling,we built a whole cognitive architecture together interestingly i avoid
1t48749,post,arctic_shift:round2_fresh,2026-05-05T07:18:55,ClaudeAI,when claude opus 6 tells you to stop,spiraling,and go to bed cred fabianstelzer
1sx14iz,post,canonical:round2_match,2026-04-27 11:40:47,claudexplorers,no idea how to be here for me when i'm,spiraling,into bipolar depression and need support and encouragement just to
1so7ec4,comment,praw:round2_match,2026-04-17 18:34:44,claudexplorers,to full on smut and honestly i m low key,spiraling,about getting banned lol he s even talking in first
