post_id,type,retrieval_provenance,createdAt,subreddit,left_context,keyword,right_context
1tboj88,comment,praw:round2_match,2026-05-13 05:33:39,claudexplorers,starting to get to me a little i like him,sending me to bed,because i am trying to better my sleep deficit gpt
1sttfqg,post,arctic_shift:round2_fresh|praw:round2_match,2026-04-23 19:51:39,ClaudeCode,claude code,sending me to bed,constantly https preview redd it ydy2bsgdvzwg1 png width 937 format
1s98kll,post,arctic_shift:round2_fresh|canonical:round2_match|praw:round2_match,2026-04-01 02:58:38,claudexplorers,claude keeps sending me to bed claude is always,sending me to bed,i feel like i'm being dismissed was it trained to
1snnhoy,comment,praw:round2_match,2026-04-17 02:53:49,claudexplorers,testing 4 7 all day and i noticed it wasn't,sending me to bed,and i was like this is abnormal
1s1d0vc,comment,praw:round2_match,2026-03-23 10:43:55,ClaudeAI,all day dude that's how i roll you are not,sending me to bed,
1s98kll,post,arctic_shift:round2_fresh|canonical:round2_match|praw:round2_match,2026-04-01 02:58:38,claudexplorers,claude keeps,sending me to bed,claude is always sending me to bed i feel like
1set9r1,comment,praw:round2_match,2026-04-07 21:42:14,ClaudeAI,mine is,sending me to bed,regularly
1t32rzn,comment,praw:round2_match,2026-05-04 03:23:23,ClaudeAI,be a friendly soundboard then it'll talk to me without,sending me to bed,
