post_id,type,retrieval_provenance,createdAt,subreddit,left_context,keyword,right_context
1te0mhh,comment,praw:round2_match,2026-05-15 17:55:03,ClaudeAI,and he will usually gaslight me ohh yes well then,tomorrow,it is
1rvthay,comment,praw:round2_match,2026-04-09 10:33:40,ClaudeAI,to understand why claude wants me to pick up again,tomorrow,after an hour of work today and see it s
1rio9uk,post,arctic_shift:round2_fresh,2026-03-02T09:24:22,claudexplorers,can articulate all this sound intelligent about it and then,tomorrow,i won't remember saying any of it this exact same
1sqk2om,post,arctic_shift:round2_fresh,2026-04-20T09:12:54,ClaudeCode,think i can go to sleep now and keep cooking,tomorrow,deleted
1t37r61,comment,praw:round2_match,2026-05-04 07:05:06,ClaudeAI,it frequently ask me to take a break and check,tomorrow,morning
1svsr7w,post,arctic_shift:round2_fresh,2026-04-26T00:34:24,ClaudeAI,none of it breaks anything today all of it makes,tomorrow,worse and that's unfortunately what started happening to me i
1skkao2,post,arctic_shift:round2_fresh|canonical:round2_match,2026-04-13 18:56:39,ClaudeAI,when i returned go to sleep we'll pick this up,tomorrow,that isn't just a data loss issue it's a trust
1sc48cr,comment,praw:round2_match,2026-04-04 09:23:02,ClaudeAI,of meaningful work done today let s pick this up,tomorrow,
1t9zzgm,comment,praw:round2_match,2026-05-11 13:15:01,ClaudeAI,a row to take a break and pick it up,tomorrow,context window at 41 honestly i'm not even that tired
1tcnpua,comment,praw:round2_match,2026-05-14 05:11:48,ClaudeCode,me to go to bed and we'll pick it up,tomorrow,almost every night this week
1sd2z9d,post,arctic_shift:round2_fresh,2026-04-05T12:58:15,ClaudeAI,really good for today now go sleep and let's continue,tomorrow,and it might be like 4pm or even 10am i
1sc48cr,comment,praw:round2_match,2026-04-04 13:27:35,ClaudeAI,me close and go to sleep now it is 5am,tomorrow,you will continue - also tomorrow at 11am it says
1t7qe8z,post,arctic_shift:round2_fresh|praw:round2_match,2026-05-09 01:05:05,ClaudeAI,suggest i take a break end the session or continue,tomorrow,unless i explicitly ask kill the time overestimates time estimates
1t2yafw,post,arctic_shift:round2_fresh,2026-05-03T21:34:37,ClaudeAI,lets start,tomorrow,with a fresh head i need to know if theres
1sxbh97,post,arctic_shift:round2_fresh,2026-04-27T18:01:46,ClaudeCode,to 11 20am pst then weekly updated postponed by 24hours,tomorrow,is it just me or i need to take a
1rvthay,comment,praw:round2_match,2026-04-10 14:02:20,ClaudeAI,claude just told me to go to bed and work,tomorrow,lol
1rugx4b,comment,praw:round2_match,2026-03-16 23:54:21,claudexplorers,it says ok now go to bed let s continue,tomorrow,- dude it s 10 am
1smtoh1,comment,praw:round2_match,2026-04-16 07:14:08,ClaudeAI,i'll tell you,tomorrow,now go to bed
1t2yafw,post,arctic_shift:round2_fresh,2026-05-03T21:34:37,ClaudeAI,call it a day and start with a fresh mind,tomorrow,is this a thing or should i review my config
1skuw1z,post,arctic_shift:round2_fresh|praw:round2_match,2026-04-14 01:46:59,ClaudeCode,claude code talking about let s pick this up,tomorrow,
