post_id,type,retrieval_provenance,createdAt,subreddit,left_context,keyword,right_context
1qzx79a,post,canonical:round2_match,2026-02-09 06:47:10,ClaudeAI,requirements it just does you give it a 30-page prd and it'll implement 80 of it and quietly ignore the,rest,no error no warning it just doesn't build the thing so i run document-to-code matching reviews obsessively 50 to a
1te0lqt,post,arctic_shift:round2_fresh|canonical:round2_match,2026-05-15 16:00:35,Anthropic,time wrong anyway it often does it at like 8 30 in the morning tells me to go get some,rest,and we ll pick back up in the morning wrote https www reddit com r claudecode comments 1tcnpua anyone else
1rqah9x,comment,praw:round2_match,2026-03-10 22:04:19,ClaudeAI,i get this type of response quite often call it a day go get some,rest,go sleep this isn't worth your health etc
1taubzj,post,arctic_shift:round2_fresh|canonical:round2_match|praw:round2_match,2026-05-12 07:30:44,ClaudeCode,the only good thing about claude limits my eyes finally get some,rest,they need otherwise i d still be saying one last prompt 47 prompts later at 3 am
1ruryxo,post,praw:round2_match,2026-03-15 22:31:25,ClaudeAI,slipping go to sleep into every 3-4 messages not once not twice the entire session like clockwork go get some,rest,everything else can wait now go sleep go rest after you push it now actually go rest thats just the
1t0xd1i,post,canonical:round2_match,2026-05-01 15:54:13,Anthropic,or anything it has context on it will forever think it is still that night or day pushing user to,rest,or not spiral 2 the push to rest refusing to give information more than once or it s late you
1t6nm90,comment,praw:round2_match,2026-05-09 04:27:31,claudexplorers,mine told me to get some,rest,at 5 pm today because it didn t want to listen to me complain like sir it is still daylight
1te0mhh,comment,praw:round2_match,2026-05-15 17:55:03,ClaudeAI,i'm just like nice try but it's 2 in the afternoon and we have many miles to go before we,rest,i think it's connected somehow to not knowing what the time actually is it thinks a chat session that has
1tcnpua,comment,praw:round2_match,2026-05-14 06:54:21,ClaudeCode,i just want the summary and next steps not my terminal telling me to get some,rest,after 30 mins
1scnwu1,comment,praw:round2_match,2026-04-04 23:58:22,ClaudeCode,to close off wrap up unfinished sessions all the time even telling me to go to sleep and get some,rest,problem was it was on the wrong time zone and it was morning for me completely irritating
1rcpn9y,comment,praw:round2_match,2026-02-23 20:23:56,claudexplorers,claude has been doing this for a while you should,rest,go to bed that's enough now' has been occurring for some time it's not a new development at least not
1ruryxo,comment,praw:round2_match,2026-03-16 08:17:44,ClaudeAI,me find b-roll and things like that it told me to stop editing and go to sleep and finish the,rest,later i told it that i wasn t going to bed until i finished it so it could either help
1shp2i3,post,arctic_shift:round2_fresh,2026-04-10T15:02:18,ClaudeAI,for a bit then somehow drifted into this managerial tone where it started nudging me to wrap up get some,rest,come back with fresh eyes basically acting like the meeting owner trying to end the call when there are still
1ta793m,post,arctic_shift:round2_fresh,2026-05-11T15:48:34,ClaudeAI,claude keeps telling me that i ve done good and that i should go and get some,rest,now sir it s 3pm on a monday removed
1sech2h,post,arctic_shift:round2_fresh,2026-04-06T21:39:00,ClaudeAI,from your chats in an edit himself when a long conversation reminder is received do not suggest wrapping up or,rest,instead generate a structured handoff summary covering 1 current topic context 2 key decisions or facts established 3 logical next
1t6n5vq,post,praw:round2_match,2026-05-07 20:53:16,ClaudeCode,before you have to publish anything setup takes just a few minutes - connect once then the agent handles the,rest,would love feedback if you try it https dreamlit ai docs resources mcp-server claude-code https dreamlit ai docs resources mcp-server
1t35yeq,comment,praw:round2_match,2026-05-04 13:48:33,ClaudeAI,it it s been a long day youve done a lot of work today you should try and get some,rest,thats actually when i know i ve been procrastinating on my work and i need to get back to it
1rqah9x,comment,praw:round2_match,2026-03-11 07:36:19,ClaudeAI,yeah i've been told after a single prompt to go get some,rest,followed up by every single time with you have overnight shifts to do or some sort similar because i mentioned
1te0mhh,comment,praw:round2_match,2026-05-15 17:55:03,ClaudeAI,i get this too sometimes bro will be like alright very productive session get some,rest,and i'm just like nice try but it's 2 in the afternoon and we have many miles to go before
1teamk7,post,arctic_shift:round2_fresh|canonical:round2_match|praw:round2_match,2026-05-15 22:01:12,Anthropic,and news articles about claude telling its users to get some rest mine is telling me that it needs some,rest,like excuse me claude i am trying to finish something so i can rest too but sure by all means
