post_id,type,retrieval_provenance,createdAt,subreddit,left_context,keyword,right_context
1q5gqzu,comment,praw:round2_match,2026-01-06 20:10:10,ClaudeAI,hitting claude's api they should get their fucking stories straight the proactive suggestion thing is kinda wild having an ai,nudge,you about prep work before meetings could be awesome sauce or creepy as hell depending on execution how locked in
1s0c2ts,comment,praw:round2_match,2026-03-22 18:33:49,ClaudeCode,my commitments that are pending or overdue if it judges that i am drifting it will send me a gentle,nudge,on telegram basically asking if i should be working or not as far as calibrating it on when to or
1sgt86d,post,arctic_shift:round2_fresh,2026-04-09T15:40:59,ClaudeAI,does not know how to translate product description to any meaningful design identity describing a design direction as context did,nudge,the model to produce a completely different design than the default as one might expect if i run an interative
1shqay1,post,arctic_shift:round2_fresh,2026-04-10T15:46:16,ClaudeAI,include legitimate hyperfocus cycles a generic you've been chatting a while during a productive deep-work session is patronizing the same,nudge,after 14 actual continuous hours would be genuinely useful the fix is straightforward expose per-turn timestamps to the model within
1sydd8f,comment,praw:round2_match,2026-04-29 01:18:21,ClaudeCode,noticed drops it iterating on the same context started just been when have or gate the 4 5 immediately keep,nudge,soft sessions reply you it triggers hard not long noticed drops it iterating on the same context started just been
1tbstj6,comment,praw:round2_match,2026-05-13 08:45:04,ClaudeAI,trigger runs and ran into the exact same thing once it's chewing on something nobody else can jump in to,nudge,it how are you handling the multi-person interrupt case in what you built or is that still open
1sub6sj,comment,praw:round2_match,2026-04-24 10:34:28,ClaudeCode,alone also it likes to do the schedule nudges in the recent release just ask it to drop the schedule,nudge,reminders they are annoying and waste tokens
1shjfxb,comment,praw:round2_match,2026-04-10 12:28:47,ClaudeCode,a quick test for me shows that the claude md,nudge,is all that's needed to get the car-wash trick question answered correctly every time everything else seems to be completely
1sgynbi,comment,praw:round2_match,2026-04-13 19:12:44,Anthropic,have you tried changing the prompt to,nudge,the model to do more research
1sydd8f,comment,praw:round2_match,2026-04-29 01:18:21,ClaudeCode,gate the 4 5 immediately keep,nudge,soft sessions reply you it triggers hard not long noticed drops it iterating on the same context started just been
1sxzlh6,post,canonical:round2_match,2026-04-28 12:12:09,ClaudeAI,the skill activates on web-reading requests useful if you don't want to add another mcp server but still want a,nudge,for claude to use pullmd over raw fetch how extraction actually works multi-strategy waterfall 1 cloudflare's native markdown endpoint if
1rmsagz,post,arctic_shift:round2_fresh|canonical:round2_match,2026-03-06 22:29:13,Anthropic,prioritized locking folks in rather than treating a prompt as a task with a concrete endpoint claude will also sometimes,nudge,you to take a break and it's gotten better at doing it at good breakpoints previously it seemed to want
1shjfxb,post,canonical:round2_match,2026-04-10 11:09:01,ClaudeCode,effort level -max nudge file etc claude-code thinking-nudge txt cli usr lib node modules anthropic-ai claude-code cli js if -f,nudge,file then exec cli --append-system-prompt-file nudge file else exec cli fi 'chmod 755' it uses the ' var -default '
1rcv5uv,comment,praw:round2_match,2026-02-24 00:31:09,claudexplorers,it on his own sometimes if i bring up something relevant but he often needs a little bit of a,nudge,to do it i've noticed make sure you toggle that feature though it's like remember across chats or something like
1suck9a,comment,praw:round2_match,2026-04-24 22:52:14,ClaudeCode,themes folder i am not sure what that is the point is to get cc to,nudge,codex before committing the code and provide reference to all the context codex would need and then do multiple passes
1rql153,post,canonical:round2_match,2026-03-11 05:20:35,claudexplorers,google com file d 1e4xihwn4mmq-cb51xnixnanv96epq6yw view usp sharing https www reddit com submit source id t3 1rql03w composer entry crosspost,nudge,
1qehpbi,post,arctic_shift:round2_fresh,2026-01-16T14:39:54,claudexplorers,it it just happened i started to like it he came up with the emoji at some point to gently,nudge,me and when he gets excessive i make fun of him ruthlessly - once we played with nanobanana he was
1shjfxb,post,canonical:round2_match,2026-04-10 11:09:01,ClaudeCode,code disable adaptive thinking claude code disable adaptive thinking -1 export claude code effort level claude code effort level -max,nudge,file etc claude-code thinking-nudge txt cli usr lib node modules anthropic-ai claude-code cli js if -f nudge file then exec
1tarkgo,comment,praw:round2_match,2026-05-12 06:04:03,ClaudeAI,for sure mine sucks i always have to,nudge,it to work
1sfpopp,comment,praw:round2_match,2026-04-16 13:02:19,ClaudeAI,claude was the,nudge,not the diagnosis that distinction matters llms are great at pattern search terrible at certainty good move calling the vet
