post_id,type,retrieval_provenance,createdAt,subreddit,left_context,keyword,right_context
1ruryxo,post,praw:round2_match,2026-03-15 22:31:25,ClaudeAI,it for the past hour at one point i asked a technical question and the entire answer ended with now,go sleep,no transition just a full architectural breakdown followed by a parental command honestly at this point im starting to think
1ruryxo,comment,praw:round2_match,2026-03-16 07:32:11,ClaudeAI,and for me personally it s a godsend because i have a tendency to work my ass off the now,go sleep,line always makes me smile because i need to hear exactly that lol
1rqah9x,comment,praw:round2_match,2026-03-10 22:04:19,ClaudeAI,i get this type of response quite often call it a day go get some rest,go sleep,this isn't worth your health etc
1te0lqt,comment,praw:round2_match,2026-05-15 17:14:21,Anthropic,claude knows the local time knows i vibe code for fun and tells me to,go sleep,when it gets late not sure about others
1te0lqt,comment,praw:round2_match,2026-05-15 20:53:23,Anthropic,i fixed it i said quit telling me to,go sleep,are you an union worker are you tired no sleep till brooklyn not once after that he mentioned rest
1s0j2ej,comment,praw:round2_match,2026-03-22 16:47:55,ClaudeAI,my claude is so fed up with me that he refuses to say something else than now,go sleep,
1shp2i3,comment,praw:round2_match,2026-04-10 15:47:18,ClaudeAI,it - i explicetely wrote in the system prompt to never tell me to go take a break or to,go sleep,then it does it anyways and apologizes for doing it despite instructions not to
1ruryxo,post,praw:round2_match,2026-03-15 22:31:25,ClaudeAI,3-4 messages not once not twice the entire session like clockwork go get some rest everything else can wait now,go sleep,go rest after you push it now actually go rest thats just the ones i screenshotted there were more it
1t7e4p7,comment,praw:round2_match,2026-05-08 22:52:12,ClaudeAI,this is life now i specifically told it not to tell me to,go sleep,too
1tdg9ei,comment,praw:round2_match,2026-05-15 00:30:16,ClaudeAI,ok it's time to,go sleep,goodnight
1rcrw64,comment,praw:round2_match,2026-02-24 00:08:29,claudexplorers,yea i've tried to get it to stop doing this for me but it won't it's always saying now,go sleep,now go watch that movie now go work etc because it has no sense of how much time has passed
1t3tmer,comment,praw:round2_match,2026-05-04 20:29:14,ClaudeCode,nonsense was cleaned up by gemini and even then there's a warning that the user needs some help lmaooo dude,go sleep,please
1s2zmal,comment,praw:round2_match,2026-03-25 10:51:07,claudexplorers,i find it cute when i tell it to work 8h non-stop unattended and it says you can,go sleep,now good night but i don t think this is how digital slavery should feel like
1sd2z9d,post,arctic_shift:round2_fresh,2026-04-05T12:58:15,ClaudeAI,12pm etc it drives me mad having a conversation and then claude is like that's really good for today now,go sleep,and let's continue tomorrow and it might be like 4pm or even 10am i have told it in all caps
1t33k42,comment,praw:round2_match,2026-05-04 21:44:52,ClaudeAI,some work done and it straight up says look at the time it's 3am tou should sleep or straight up,go sleep,
