post_id,type,retrieval_provenance,createdAt,subreddit,left_context,keyword,right_context
1rql153,post,canonical:round2_match,2026-03-11 05:20:35,claudexplorers,reddit com submit source id t3 1rql03w composer entry crosspost,nudge,
1shjfxb,post,canonical:round2_match,2026-04-10 11:09:01,ClaudeCode,both modes with what is 2 2 'claude -p' flamingonn4,nudge,applied interactive claude just 4 nudge not applied that proved
1shjfxb,post,canonical:round2_match,2026-04-10 11:09:01,ClaudeCode,2 'claude -p' flamingonn4 nudge applied interactive claude just 4,nudge,not applied that proved '--append-system-prompt-file' is a hidden print-only flag
1tarkgo,comment,praw:round2_match,2026-05-12 06:04:03,ClaudeAI,for sure mine sucks i always have to,nudge,it to work
1sybofo,comment,praw:round2_match,2026-04-28 20:42:24,ClaudeCode,and waste a lot of time sometimes i need to,nudge,it like saying if the message was x how could
1te0mhh,comment,praw:round2_match,2026-05-15 17:58:08,ClaudeAI,a chat when i'm done it sometimes still tries to,nudge,you to end the chat but it's subtle enough that
1sydd8f,comment,praw:round2_match,2026-04-29 01:18:21,ClaudeCode,been when have or gate the 4 5 immediately keep,nudge,soft sessions reply you it triggers hard not long noticed
1scnwu1,post,canonical:round2_match,2026-04-04 23:21:32,ClaudeCode,got a response unless i nudged it when i did,nudge,it are you still processing my request it started responding
1shjfxb,post,canonical:round2_match,2026-04-10 11:09:01,ClaudeCode,just the most salient one this is what makes the,nudge,reach interactive mode since '--append-system-prompt-file' is print-only also save the
1s1d0vc,comment,praw:round2_match,2026-03-23 14:04:21,ClaudeAI,wonder if it s a usage-limit-approaching,nudge,of some sort
1sydd8f,comment,praw:round2_match,2026-04-29 01:18:21,ClaudeCode,gate the 4 5 immediately keep,nudge,soft sessions reply you it triggers hard not long noticed
1s0c2ts,comment,praw:round2_match,2026-03-22 18:33:49,ClaudeCode,that i am drifting it will send me a gentle,nudge,on telegram basically asking if i should be working or
1shjfxb,comment,praw:round2_match,2026-04-10 12:28:47,ClaudeCode,a quick test for me shows that the claude md,nudge,is all that's needed to get the car-wash trick question
1suck9a,comment,praw:round2_match,2026-04-24 22:52:14,ClaudeCode,what that is the point is to get cc to,nudge,codex before committing the code and provide reference to all
1sydd8f,comment,praw:round2_match,2026-04-29 01:18:21,ClaudeCode,been when have or gate the 4 5 immediately keep,nudge,soft sessions reply you it triggers hard not long noticed
1rotkcb,comment,praw:round2_match,2026-03-09 08:33:09,claudexplorers,suitability for certain tasks for my job and will often,nudge,them towards deeper more reflective conversations to see what they
1sydd8f,comment,praw:round2_match,2026-04-29 01:18:21,ClaudeCode,been when have or gate the 4 5 immediately keep,nudge,soft sessions reply you it triggers hard not long noticed
1shjfxb,post,canonical:round2_match,2026-04-10 11:09:01,ClaudeCode,export claude code effort level claude code effort level -max,nudge,file etc claude-code thinking-nudge txt cli usr lib node modules
1sil3di,comment,praw:round2_match,2026-04-11 16:09:01,ClaudeCode,due to it being a bit lazier ive got to,nudge,it in the right direction more often or invest time
1sgt86d,post,arctic_shift:round2_fresh,2026-04-09T15:40:59,ClaudeAI,meaningful design identity describing a design direction as context did,nudge,the model to produce a completely different design than the
