post_id,type,retrieval_provenance,createdAt,subreddit,left_context,keyword,right_context
1s3c0v5,post,arctic_shift:round2_fresh,2026-03-25T14:17:07,ClaudeCode,working i was just waiting i wanted to take a,break,go for a short walk reset but i couldn t
1sixyoq,post,arctic_shift:round2_fresh,2026-04-11T23:13:05,ClaudeAI,has told me to go to sleep or take a,break,multiple times unprompted in the middle of regular follow-up questions
1sg9enj,post,arctic_shift:round2_fresh,2026-04-08T23:42:57,ClaudeCode,of them have the same 5 time bombs that will,break,your app the second you get real users here is
1rrm3e6,post,arctic_shift:round2_fresh,2026-03-12T09:29:39,claudexplorers,it feels different i think i need to take a,break,
1sxbh97,post,arctic_shift:round2_fresh,2026-04-27T18:01:46,ClaudeCode,is it just me or i need to take a,break,from cc lol
1r7zsa0,post,arctic_shift:round2_fresh,2026-02-18T10:47:28,claudexplorers,your eyes open remember if you need to take a,break,do it ps to anyone who will say i am
1shp2i3,comment,praw:round2_match,2026-04-10 15:47:18,ClaudeAI,system prompt to never tell me to go take a,break,or to go sleep then it does it anyways and
1s59lkw,comment,praw:round2_match,2026-03-27 17:18:50,ClaudeCode,written a deep dive on prompt caching - if you,break,the cache - you pay the full price https www
1shnz7l,post,arctic_shift:round2_fresh,2026-04-10T14:22:33,ClaudeCode,rebuild it now or would you prefer to take a,break,and pick this up fresh when running agents what llm
1qegdnb,post,canonical:round2_match,2026-01-16 13:47:07,ClaudeAI,between tabs couldn't pull the trigger didn't know how to,break,down the problem we don't talk about the claude days
1rsah3z,post,arctic_shift:round2_fresh,2026-03-13T01:57:17,claudexplorers,teaching a tuesday rilke probably the phone rang during the,break,and i didn't answer because i was talking to a
1szjias,comment,praw:round2_match,2026-04-30 20:27:29,Anthropic,cash cow so they will be willing to take a,break,even or slight loss
1sm3jlg,comment,praw:round2_match,2026-04-15 12:56:31,ClaudeAI,considering how often claude tries to take a,break,and stop working lately i find this disturbing
1rnayou,post,arctic_shift:round2_fresh|canonical:round2_match,2026-03-07 14:12:15,claudexplorers,4 6 i like to let my claude take a,break,just go have fun and do whatever without me he
1rhe89z,post,canonical:round2_match,2026-02-28 21:14:25,ClaudeCode,risk every edit touches everything fix a formatting rule accidentally,break,code review behavior blast radius entire prompt the modular setup
1te0lqt,comment,praw:round2_match,2026-05-15 17:28:34,Anthropic,nintendo wii vibes maybe you should take a,break,
1sx8sdr,post,arctic_shift:round2_fresh,2026-04-27T16:29:17,ClaudeAI,hardware please beat me to it i'll probably take a,break,and go knock out phase operators for chess4d-oc if you
1rvthay,comment,praw:round2_match,2026-03-17 02:34:39,ClaudeAI,reddit look maybe it s time to take a screen,break,and go to bed
1shqay1,post,arctic_shift:round2_fresh,2026-04-10T15:46:16,ClaudeAI,nudges you've been at this a while maybe take a,break,are well-intentioned but structurally broken the model has no access
1soty1x,post,arctic_shift:round2_fresh,2026-04-18T10:24:49,ClaudeCode,- how much of my app am i about to,break,blast radius it bridges the gap between it works and
