post_id,type,retrieval_provenance,createdAt,subreddit,left_context,keyword,right_context
1qvb3ye,post,arctic_shift:round2_fresh|canonical:round2_match|praw:round2_match,2026-02-04 01:42:13,claudexplorers,yes but also you are,tired,go take a break now
1te0mhh,comment,praw:round2_match,2026-05-15 17:55:03,ClaudeAI,therefore i must be super,tired,by now lol definitely doesn't
1tceby9,comment,praw:round2_match,2026-05-14 01:38:01,ClaudeAI,a better framing are you,tired,of the ai telling you
1tcnpua,comment,praw:round2_match,2026-05-14 12:41:03,ClaudeCode,if you mention your sleepy,tired,etc then it tries to
1r7zu8r,post,arctic_shift:round2_fresh,2026-02-18T10:50:43,claudexplorers,t case and i felt,tired,exhausted of staying up looking
1te0lqt,comment,praw:round2_match,2026-05-15 20:53:23,Anthropic,an union worker are you,tired,no sleep till brooklyn not
1qx0v5y,comment,praw:round2_match,2026-02-06 01:53:43,claudexplorers,installs yes claude but i'm,tired,of cuda garbage lol
1t9zzgm,post,arctic_shift:round2_fresh|canonical:round2_match,2026-05-11 11:05:24,ClaudeAI,m the one who looks,tired,hahaha i only wanted him
1tcetsd,comment,praw:round2_match,2026-05-13 22:39:02,ClaudeAI,complete jobs i'm really getting,tired,of the park for tonight
1t0xd1i,post,canonical:round2_match,2026-05-01 15:54:13,Anthropic,before responding the you re,tired,rest gaslighting is also a
1stgtfu,post,arctic_shift:round2_fresh,2026-04-23T12:05:58,ClaudeCode,panic since i am not,tired,enough yet my effort level
1syxwpt,comment,praw:round2_match,2026-04-29 22:35:53,ClaudeCode,get some rest you look,tired,
1scy9bu,comment,praw:round2_match,2026-04-05 09:03:05,ClaudeCode,pretty good if you are,tired,of babysitting prs all night
1sfgms8,post,arctic_shift:round2_fresh,2026-04-08T02:39:28,ClaudeCode,workflows while you sleep got,tired,of babysitting claude code task
1sxzlh6,post,canonical:round2_match,2026-04-28 12:12:09,ClaudeAI,few weeks because i got,tired,of two things 1 mobile
1r7zsa0,post,arctic_shift:round2_fresh,2026-02-18T10:47:28,claudexplorers,t case and i felt,tired,exhausted of staying up looking
1svu284,comment,praw:round2_match,2026-04-26 01:45:51,ClaudeCode,that indicates you have gotten,tired,or frustrated before after a
1t0xd1i,post,canonical:round2_match,2026-05-01 15:54:13,Anthropic,time amnesia and you re,tired,logic i ve noticed 2
1rio9uk,post,arctic_shift:round2_fresh,2026-03-02T09:24:22,claudexplorers,a break can't say i'm,tired,everything i do is predetermined
1qvb3ye,post,arctic_shift:round2_fresh|canonical:round2_match|praw:round2_match,2026-02-04 01:42:13,claudexplorers,me i'm good a little,tired,from the long day claude
