post_id,type,retrieval_provenance,createdAt,subreddit,left_context,keyword,right_context
1sinjd4,comment,praw:round2_match,2026-04-11 18:05:50,Anthropic,does this explain the now,go to bed,behavior as well
1t7e4p7,comment,praw:round2_match,2026-05-08 17:37:43,ClaudeAI,it's time for you to,go to bed,good night
1swa5h9,comment,praw:round2_match,2026-04-26 23:47:26,ClaudeCode,tired of it suggesting i,go to bed,and telling me a 30
1tcnpua,comment,praw:round2_match,2026-05-14 05:05:42,ClaudeCode,late and i want to,go to bed,claude quickly resolved the issue
1s820s3,comment,praw:round2_match,2026-03-30 21:36:05,ClaudeAI,roughly around when i do,go to bed,so i know it s
1s16eiz,comment,praw:round2_match,2026-03-23 06:38:54,ClaudeAI,3 days telling me to,go to bed,after every other prompt then
1tavnep,comment,praw:round2_match,2026-05-12 09:39:44,ClaudeCode,claude code told me to,go to bed,at 9am it's getting ridiculous
1tdg4jz,comment,praw:round2_match,2026-05-15 00:30:04,ClaudeCode,by this guess i ll,go to bed,then
1s7n7ov,comment,praw:round2_match,2026-04-02 01:54:35,claudexplorers,claude always tell us to,go to bed,assumed it was just me
1s1a14v,comment,praw:round2_match,2026-03-24 04:06:55,ClaudeAI,claude desktop constantly suggests i,go to bed,rest take a walk eat
1tcnpua,comment,praw:round2_match,2026-05-14 05:11:48,ClaudeCode,he has told me to,go to bed,and we'll pick it up
1sujpzf,post,arctic_shift:round2_fresh|canonical:round2_match,2026-04-24 15:55:34,claudexplorers,all-caps rant about refusing to,go to bed,and threatening self-harm i imagine
1sw99bl,comment,praw:round2_match,2026-04-29 23:06:18,ClaudeCode,task blah blah blah now,go to bed,the nerve
1tboj88,comment,praw:round2_match,2026-05-13 06:37:21,claudexplorers,mines told me to,go to bed,so much i now just
1s5t4at,comment,praw:round2_match,2026-03-28 07:59:25,ClaudeAI,mine keeps telling me to,go to bed,
1s220dp,comment,praw:round2_match,2026-03-24 06:56:21,claudexplorers,just gives up trying lol,go to bed,
1q6626y,comment,praw:round2_match,2026-01-07 05:54:22,ClaudeAI,and yesterday it insisted i,go to bed,because i needed to get
1t0dcmu,comment,praw:round2_match,2026-05-01 05:53:04,claudexplorers,ps yes yes i will,go to bed,i will not overwork
1q3l18j,comment,praw:round2_match,2026-01-04 19:46:03,claudexplorers,do claude tells me to,go to bed,and never stops even the
1tblluj,comment,praw:round2_match,2026-05-13 02:13:07,ClaudeCode,many stupid mistakes and just,go to bed,i m probably low effort
