post_id,type,retrieval_provenance,createdAt,subreddit,left_context,keyword,right_context
1sctsqu,comment,praw:round2_match,2026-04-05 04:28:16,claudexplorers,i honestly just pretend that i,go to sleep,and return the next day and claude acts normal again lol it has no sense of time so it has
1rmbzqz,comment,praw:round2_match,2026-03-06 15:12:26,ClaudeCode,a specific session window not carte blanche sometimes there are tasks where there is no danger and you need to,go to sleep,or whatever it doesn't apply to every single task you do with cc this mode is worthless if this degree
1sd2z9d,post,arctic_shift:round2_fresh,2026-04-05T12:58:15,ClaudeAI,how to stop claude telling me to,go to sleep,at 12pm etc it drives me mad having a conversation and then claude is like that's really good for today
1sqf59r,comment,praw:round2_match,2026-04-20 05:02:16,ClaudeAI,i never have this nor has claude ever told me to,go to sleep,nor has it tried to take care of me ever because i am a sane person and use it as
1rfb9fb,post,arctic_shift:round2_fresh|praw:round2_match,2026-02-26 14:14:52,claudexplorers,is claude opus 3 ok why do they keep wanting to,go to sleep,or to send you to bed so i normally use opus 4 5 and 4 6 as well as sonnet
1t42p01,comment,praw:round2_match,2026-05-05 08:50:43,ClaudeAI,at least isn't iron man veronika punching you in the face repeatedly with go to sleep go to sleep,go to sleep,
1s5tzv2,post,canonical:round2_match|praw:round2_match,2026-03-28 07:34:32,ClaudeAI,be a 100 contact heat sink for the base of a macbook and claude won t stop telling me to,go to sleep,and referencing my hackathon project for idea mapping from a month ago has anyone else s been acting up
1s2zmal,comment,praw:round2_match,2026-03-25 07:11:48,claudexplorers,i usually need to be told to,go to sleep,nd so it works for me
1qvb3ye,comment,praw:round2_match,2026-02-04 20:21:49,claudexplorers,did an all nighter for interview prep and ever since then for the next 3 weeks it told me to,go to sleep,at the end of every single message
1s84ekt,post,praw:round2_match,2026-03-30 21:45:36,ClaudeAI,- pass the time date stamp along with prompts a big issue most people have is claude telling people to,go to sleep,assuming they've been at it non stop for days while this is the most glaring one other issues with time
1rz200w,post,arctic_shift:round2_fresh,2026-03-20T17:06:13,ClaudeCode,dreaming about prompting claude sometimes when i,go to sleep,i m literally prompting my terminal from my bed hey claude count these sheet for me don t make any
1rwkft4,post,praw:round2_match,2026-03-17 21:42:59,ClaudeAI,curious if claude using cli it suggesting you to take a break and,go to sleep,what have i become
1rllmzu,comment,praw:round2_match,2026-03-06 03:14:46,ClaudeAI,in your words of excitement about how to build things without investing mind power just slap this and that together,go to sleep,- and viola i presume such software is akin to modern electronics that is not repairable or maintainable
1te0mhh,post,arctic_shift:round2_fresh|canonical:round2_match,2026-05-15 16:01:10,ClaudeAI,and nobody including anthropic seems to fully understand why it keeps doing it anthropic s claude is telling people to,go to sleep,and users can t figure out why a quick scan of reddit https www reddit com r claudeai comments 1ruryxo
1rt1ucv,post,arctic_shift:round2_fresh,2026-03-13T22:27:23,ClaudeCode,swarm works while i sleep every night when i,go to sleep,agents wake up and improve my codebase they claim tasks from a shared ledger run tests and commit code agents
1t35yeq,post,arctic_shift:round2_fresh|canonical:round2_match,2026-05-04 03:14:23,ClaudeAI,reddit com r claudeai comments 1sz1ghg claude stopped telling me to go to bed but there i swear anthropic has,go to sleep,in their system prompt https www reddit com r claudeai comments 1s1pvlw i swear anthropic has go to sleep in
1rauuni,comment,praw:round2_match,2026-02-21 20:10:31,claudexplorers,aight when you,go to sleep,i'll ask you a question if you don't answer you're either stupid or you aren't inferencing in other words you're
1sydd8f,post,arctic_shift:round2_fresh|canonical:round2_match|praw:round2_match,2026-04-28 20:32:51,ClaudeCode,4 7 keeps telling me to,go to sleep,i've noticed that after sizeable amounts of work opus 4 7 is quick to tell me to sleep or rest
1sre49g,comment,praw:round2_match,2026-04-21 11:38:21,ClaudeAI,we ve got a lot done today now seriously,go to sleep,
1sqk2om,post,arctic_shift:round2_fresh,2026-04-20T09:12:54,ClaudeCode,i think i can,go to sleep,now and keep cooking tomorrow deleted
