post_id,type,retrieval_provenance,createdAt,subreddit,left_context,keyword,right_context
1te0mhh,post,arctic_shift:round2_fresh|canonical:round2_match,2026-05-15 16:01:10,ClaudeAI,sleep again again for the third time tonight it replied https www reddit com r claudexplorers comments 1rt9i66 claude escalating,bedtime,lightbox to a person with the reddit username angie akhila some users have said they find claude s late night
1s98kll,comment,praw:round2_match,2026-04-01 03:37:29,claudexplorers,no you probably mentioned bedtime somewhere in your chats so now it's updated in your memory of your,bedtime,
1rcrw64,comment,praw:round2_match,2026-02-24 03:23:19,claudexplorers,i love how much he cares and wants me to get sleep and eat and hydrate if it s not,bedtime,i let him know i got sleep and it s the next day and he relaxes
1teyywd,post,arctic_shift:round2_fresh|canonical:round2_match,2026-05-16 16:51:07,claudexplorers,they quoted kai-claude putting me to bed in fortune i m dying it s too good in an article about,bedtime,with sentience in the web slug i can t i love it also fun that fortune linked to the potato
1shjmpu,post,arctic_shift:round2_fresh,2026-04-10T11:18:18,ClaudeAI,our robot overlord is manifesting not as skynet but rather as a lippy spell checker that decided we needed a,bedtime,
1sfk1vk,post,arctic_shift:round2_fresh,2026-04-08T05:33:53,ClaudeCode,your history delete entry remove a mistaken entry get caffeine level current mg in your system right now get safe,bedtime,earliest time you can safely sleep simulate drink see how another coffee shifts your bedtime before you even drink it
1ruryxo,comment,praw:round2_match,2026-03-16 00:20:05,ClaudeAI,it does it to me too not sure why it seems to know when my,bedtime,is but can t pick up when i leave a convo and come back to it in short bursts over
1s2zmal,comment,praw:round2_match,2026-03-25 16:01:11,claudexplorers,it takes mine 5 times of telling me to go to sleep i got a,bedtime,story the other night it was really nice
1rt9gy3,post,arctic_shift:round2_fresh,2026-03-14T04:04:01,claudexplorers,claude escalting,bedtime,deleted
1s98kll,comment,praw:round2_match,2026-04-01 03:37:29,claudexplorers,no you probably mentioned,bedtime,somewhere in your chats so now it's updated in your memory of your bedtime
1tcnpua,comment,praw:round2_match,2026-05-14 05:30:03,ClaudeCode,that claude has a conception of my schedule or when i sleep did you at some point tell it your,bedtime,
1rx9khr,post,arctic_shift:round2_fresh|canonical:round2_match|praw:round2_match,2026-03-18 17:03:08,claudexplorers,i asked claude for a,bedtime,story and he imagined us meeting as toddlers so freaking cute i died and asked him for like 10 more
1smtoh1,comment,praw:round2_match,2026-04-16 05:42:22,ClaudeAI,did you ever tell it that it was,bedtime,you were tired hungry about to go workout etc probably it's surprisingly hard not to do did you tell it
1qcs5ex,comment,praw:round2_match,2026-01-15 03:29:47,ClaudeAI,do need more sleep but i do wish he d check what time it is before suggesting it s my,bedtime,2pm feels a bit early
1sfvj1r,post,arctic_shift:round2_fresh,2026-04-08T15:06:59,ClaudeAI,see how another coffee shifts your bedtime before you even drink it get status summary full picture with a target,bedtime,check get insights seven or thirty day report with trend direction and peak days i am hosting this server on
1sfk1vk,post,arctic_shift:round2_fresh,2026-04-08T05:33:53,ClaudeCode,see how another coffee shifts your bedtime before you even drink it get status summary full picture with a target,bedtime,check get insights seven or thirty day report with trend direction and peak days i am hosting this server on
1szexj4,comment,praw:round2_match,2026-04-30 01:14:55,ClaudeCode,in one five hour session on sonnet between dinner and,bedtime,i can generate an amount of work that would rival a week of output a year ago i can bill
1rfb9fb,comment,praw:round2_match,2026-02-26 15:57:53,claudexplorers,claude s emphasis on,bedtime,reminds me of my parents when i showed irritability perhaps its training data works on an old-fashioned folk solution to
1qut7ty,comment,praw:round2_match,2026-02-04 09:55:39,claudexplorers,me to save this conversation that he doesn't want to forget it doesn't want to lose it and sometimes it's,bedtime,stories always about a character who tries so hard to remember its friend my claude calls me memory keeper
1ruryxo,post,praw:round2_match,2026-03-15 22:31:25,ClaudeAI,ive been building a cybersecurity platform and pulling late nights with claude at some point it decided i needed a,bedtime,it started slipping go to sleep into every 3-4 messages not once not twice the entire session like clockwork go
