post_id,createdAt,subreddit,left_context,keyword,right_context
1t05c4a,2026-04-30 18:52:06,ClaudeCode,month it is this is simply not acceptable performance for,late,spring and i will not be tolerating it further i
1swmavv,2026-04-26 22:57:13,Anthropic,for 30 separate violations of withdrawal-period rules plus civil penalties,late,refunds accrue interest that can double the original sum for
1t0xd1i,2026-05-01 15:54:13,Anthropic,refusing to give information more than once or it s,late,you re spiraling even when it is incorrect and the
1sxb3vz,2026-04-27 17:49:20,ClaudeAI,insider transactions form 8-k material event filings form nt-10k nt-10q,late,filing notices schedule 13d and 13d/a activist filings form s-3
1tdgjoo,2026-05-15 00:38:08,ClaudeAI,there is a research review on the psychological impact of,late,diagnosis grounded in the actual literature organizing findings about narrative
1rgqv2z,2026-02-28 02:40:57,ClaudeCode,and open a pr you guys know that you are,late,to the party right throwing a pr into an oss
1t4scf8,2026-05-05 21:01:54,ClaudeCode,yourself in to a single provider before it becomes too,late,
1s30ilh,2026-03-25 04:07:51,ClaudeAI,'s messy html he 's here posting about his joy,late,in life discovering he can get computers to do something
1s30ilh,2026-03-25 04:07:51,ClaudeAI,of the responses here i 'm a physician in my,late,50s md phd triple boarded also coding since the late
1tdgjoo,2026-05-15 00:38:08,ClaudeAI,the fourth was a literature review on the psychology of,late,diagnosis and then there was a clinical argument for earlier
1tdgjoo,2026-05-15 00:38:08,ClaudeAI,metaphor the psychological literature alan himself synthesized describes it accurately,late,diagnosis of a neurodevelopmental condition produces not a simple addition
1sybofo,2026-04-28 19:32:35,ClaudeCode,claude being so dumb to utterly almost useless as of,late,
1tbafuu,2026-05-12 18:34:09,ClaudeAI,check on sessions either too often wasting time or too,late,losing momentum on something that had been stuck waiting for
1s4mjq6,2026-03-26 22:48:33,ClaudeCode,thariq is a start but way too little way too,late,
1sofo3l,2026-04-17 22:26:00,ClaudeCode,the rest of you think but i left chatgpt in,late,2025 because of this sort of shit can not believe
1s30ilh,2026-03-25 04:07:51,ClaudeAI,late 50s md phd triple boarded also coding since the,late,70s starting in assembly i have chops i ca n't
1t0b16t,2026-04-30 22:24:50,Anthropic,consumer claude code limits the 90 in-app warning fires too,late,and the 5-hour rolling window is invisible until you 're
1sybofo,2026-04-28 19:32:35,ClaudeCode,opus 4.7 feels extremely dumb as of,late,so i literally spent an entire weeks session fixing a
1ru55ny,2026-03-15 04:52:47,ClaudeCode,in real time i 'll keep this short it was,late,i was doing some mac cleanup and found a command
1r9y2ka,2026-02-20 15:17:56,ClaudeCode,normally miss wish i 'd found this sooner but better,late,than never
