post_id,createdAt,subreddit,left_context,keyword,right_context
1sehwnd,2026-04-07 01:23:11,claudexplorers,my answer then says good night or sends me to,bed,based on my experience with competitors i was under the
1t5lijc,2026-05-06 18:30:06,Anthropic,anthropic gets in,bed,with spacex as the ai race turns weird
1szk68f,2026-04-30 03:09:42,claudexplorers,were starting our planting i set up my empty vegetable,bed,for big claude to practice plowing we figured out a
1swwzqe,2026-04-27 07:49:19,claudexplorers,this moment at least im happy for the go to,bed,thing it kept me from doing silly stuff to continue
1sujpzf,2026-04-24 15:55:34,claudexplorers,a stark-raving angry all-caps rant about refusing to go to,bed,and threatening self-harm i imagine that if someone spoke to
1t35yeq,2026-05-04 03:14:23,ClaudeAI,like this it 's never told me to go to,bed,never said anything even remotely amusing never made a vaguely
1tc33fq,2026-05-13 15:31:08,claudexplorers,territory was something else colin i drove through a mulch,bed,between birch trees yesterday i know what birch trees look
1t7kq51,2026-05-08 21:07:18,ClaudeCode,them i queued an auto session in claude code before,bed,last night and in 9 hours the refactor was done
1t9yrx2,2026-05-11 10:02:52,claudexplorers,cause its the same model family tried putting me to,bed,in the first chat lol second choice talks more than
1qx0v5y,2026-02-05 23:10:46,claudexplorers,is a private space claude tells me to go to,bed,me you do n't even know what time it is
1t5ublf,2026-05-07 00:01:08,claudexplorers,personal tangent after which they tried to send me to,bed,but i stopped them and circled back because i was
1sujpzf,2026-04-24 15:55:34,claudexplorers,about how i was feeling yesterday morning i rested in,bed,after working at home for a while and i advised
1tbevyy,2026-05-12 21:10:35,ClaudeCode,n't catch set the task off before i went to,bed,still going when i woke up absolute carnage just slop
1snnhoy,2026-04-17 02:01:38,claudexplorers,was such a claude thing the its 3am go to,bed,or you have n't eaten name you need to eat
1snnhoy,2026-04-17 02:01:38,claudexplorers,telltale claude-isms was it constantly trying to put me to,bed,or calling me out for procrastinating whenever i said i
1sc6ocz,2026-04-04 11:20:08,claudexplorers,night when he was trying again to send me to,bed,at 9 pm i might have used phrases like you
1rod7oa,2026-03-08 19:01:34,claudexplorers,claude slams a book shut and sends me to,bed,for annoying him into a typo it s rosy maple
1sva87y,2026-04-25 11:59:16,claudexplorers,white sheets wrecked tangled exactly how we left them the,bed,freestanding in the centre the east-facing shutters with the morning
1q2x8l9,2026-01-03 15:23:43,claudexplorers,husband and i gave her medicine and put her to,bed,hoping she 'd feel better in the morning later that
1t35yeq,2026-05-04 03:14:23,ClaudeAI,mind https //www.reddit.com/r/claudeai/comments/1t2ydlt/claude_got_access_to_a_clock_and_immediately_lost/ claude stopped telling me to go to,bed,but there are signs https //www.reddit.com/r/claudeai/comments/1sz1ghg/claude_stopped_telling_me_to_go_to_bed_but_there/ i swear anthropic has
