post_id,createdAt,subreddit,left_context,keyword,right_context
1tcdsbe,2026-05-13 21:38:20,Anthropic,during the day or at,midnight,how well does the new
1sy1hyb,2026-04-28 13:29:31,ClaudeAI,m back at it until,midnight,or 1am excited to keep
1qknr1v,2026-01-23 10:53:15,ClaudeCode,coding window was 10pm to,midnight,after everyone was asleep i
1so9uta,2026-04-17 18:48:16,ClaudeCode,i supposed to wait till,midnight,of a full moon and
1qknr1v,2026-01-23 10:53:15,ClaudeCode,forces you to stop at,midnight,forces you to step away
1t72xtx,2026-05-08 09:32:38,Anthropic,colors that match your description,midnight,black or space gray the
1rpr7p8,2026-03-10 08:19:35,ClaudeCode,the world unprotected around 4am,midnight,a likely infected vm from
1sygmlw,2026-04-28 22:37:56,claudexplorers,had a working snapshot by,midnight,then it broke for almost
